,0,1
631,"#NOWOPENING Yang baru Bulan #oktober di #metmallcileungsi mommy-mommy yang suka mix and match outfit si kecil dengan sepatu keren, yuks kunjungi OVA Children Wear di lantai dasar #metmallcileungsi Dapatkan diskon 20% moms! https://t.co/uTQQIki5Zg",MetMalCileungsi
632,"Borong yuk, ada diskon spesial buat km ",viechadott
633,Terus tetiba LAP lagi diskon. Yallah galau beli sehun atau daniel,AnnisaGuseldha
634,Harga Tiket (belum termasuk diskon) Balkon Rp 100.000 Reguler Rp 175.000 VIP Rp 250.000 VVIP Rp 300.000 Platinum Rp 500.000  Informasi Tiket : Faisal (+62 812 8045 4989)  Instagram dan Twitter: @TeaterPandora #RumahRahasiaPerempuan #TeaterPandora,BVOICERADIO
635,@kwonhoshxx Synnara lagi ada diskon wkwkwk,svtblanket
636,ya baik kenapa saya tidak kepikiran beli di website mizanstore saja yg ada diskon. menyesal takan ada arti ,triaaf
637,Bros dagu nama liontin  Huruf pertama +liontin 12K. Huruf selanjutnya +4000 Misal nama dengan 3 huruf : 12.000 +4000 +4000 : 20.000 (harag ecer)  Diskon hingga 35% untuk pembelian skala besar  #brosdagu #brosgrosir #supplierbros #aksesorishijab,rajarajut
638,"@didisappointed @irmagrs kalo mau murah dibawah 100rb tp ori, biasanya beli di aeon mall suka diskon gt jadi 90an, pun kalo gadiskon harganya gasampe 125k kyk di watson/guardian",irsyadiputre
639,"@TransvisionID Cari Chanel Anak , Movie, Olahraga , Berita , Religi , Korea , Lifestyle ? Hanya di Transvision , lagi promo diskon 50% khusus hari ini ,, https://t.co/ojG0rnIKfr",Ipoel76181340
640,November sudah tiba  Saat nya cuci toren air anda dan dapatkan potongan diskon 10% untuk semua ukuran. Informasi lebih lanjut hub kami @sapubersih.id https://t.co/wp4MVVnvXf https://t.co/SrylL54sH7,Sapubersihbdg
641,. November to remember  Jangan lewatkan GLOSKIN SUPANOVA  . Diskon hingga 40% Advanced Filler (Restylane Lyft or Vital light)  . DISC 10% Buy 1 cc DISC 20% Buy 2 cc DISC 30% Buy 3 https://t.co/qs9lSAC4gR,gloskin_clinic
642,"Buat Kartu Diskon Oriflame bulan November ini...   MENANG BANYAK.....   Kenapa????  Karena bulan ini, buat kartu diskon Oriflame yg bisa dipake selama 12 bulan itu cuma Rp.9,900 aja...    Plus saat kamu... https://t.co/86HsvCrSiN",MrAnikSugiarta
643,Gunakan Honda Club Card untuk pengguna motor Honda dapatkan diskon di merchant bertanda Kartu Honda dan daftar langsung ke HONDA Trio Motor,kalaweit991FM
644,"tidak akan seorangpun yang bisa berpaling menatap katalog dan membuka halaman pertama hingga terakhir, berisikan :  1. Produk baru dengan harga spesial perkenalan.  2. Penawaran dengan diskon yang selalu menguntungkan pelanggan, mulai dari diskon... https://t.co/mOjOYMINUR",Cantik_Mandiri
645,FREE ONGKIR UNTUK PENGAMBILAN DUA PAKET PLUS DISKON KHUSUS !,anitasherbal
646,@Regran_ed from @dcost_seafood  -  Hai Seafood Lovers. Diskon 50% Setiap Hari untuk menu yang berbeda masih ada loh. . Jangan lupa datang dan nikmati setiap menu dari https://t.co/e6K6GBVZqD,DmallDepok
647,"Preorder bukuku masih tersedia hingga tanggal 6 November :)  Ada bonus postcard, sign, dan diskon 20% khusus untuk preorder  @NouraPublishing @mizanstore   Kamu bisa mengikuti preordernya melalui link berikut: https://t.co/McB9cLrnDd https://t.co/NrWWGVjTXj",dittameliaa
648,Promo diskon up to 20% untuk produk dari @illuminare_idn di #CenturyDelivery!  Pesan kebutuhan kecantikan anda di #CenturyDelivery dengan menghubungi 14060 atau melalui aplikasi Whatsapp di nomor 0858-9100-6668.  *S&amp;K berlaku https://t.co/EVUNdRaJ0r,century_14060
649,"HARGA CASH / KREDIT MOTOR YAMAHA FINO 125 TERBARU. Tersedia Promo DP Murah, Diskon Besar dan Banyak Bonus untuk wilayah Jakarta, Tangerang, Depok, Bekasi dan Bogor https://t.co/px6vYkeFgN",yamaha_mekar
650,"Berbagai diskon dan program menarik menunggumu! Yuk datang dan kunjungi Pameran IT terbesar di Indonesia : Indocomtech, 31 Oktober  4 November 2018 di Jakarta Convention Center. #Indocomtech #Indocomtech2018 #JCCSenayan #Jakarta https://t.co/2iPLvNEgTO",KompasTekno
651,Ketika kamu dapat promo diskon sampe maksimal tanggal di mana kamu belum membutuhkannya #AgakMikirJugaNulisnya https://t.co/norpJiFCfj,kris_rahardian
652,Pakai ePay BRI bisa traveling! Yuk pesan di @Padiciti ada diskon Rp25rb untuk tiket bus dan kereta api. Berlaku setiap Rabu. https://t.co/qct0OnguAg,promo_BRI
653,hello kakak ada yang baru nih dan diskon 10 %  my bottle kaca + sarung + saringan teh wah komplit sekali yaaah  my bottle terbaru ini memiliki bahan kaca dan mempunyai saringat teh di bagian bawah nyaaa... https://t.co/mpeGC9dDok,Tiff_houseware
654,"Berbagai diskon dan program menarik menunggumu!  Yuk datang dan kunjungi Pameran IT terbesar di Indonesia : Indocomtech, 31 Oktober  4 November 2018 di Jakarta Convention Center.  #Indocomtech #Indocomtech2018 #JCCSenayan #Jakarta https://t.co/rK5zVn68le",BeritagarInfo
655,"YEAR END SALE kunjungi FITPLUS Pondok Indah Mall 2 lt.3,  Dapatkan Diskon  up to 75% hingga 31 Desember 2018, Info 021-7506832 https://t.co/1sRB8FCxzS",PondokIndahMall
656,Yuk dicek produk2 oriflame yg lagi diskon di bulan november ceria ini.  Yang mau dikirimin katalog online atau yang mau harga member langsung chat di inbox atau WA ke 083114001540 ,dewisujaningsih
657,"@BankSinarmas Membuat catatan/daftar pengeluaran, Kurangi belanja dadakan saat diskon, belanja kebutuhan pokok sekali seminggu agar tak mubazir berlebihan karena busuk, bawa bekal biar hemat &amp; lebih higienis, hindari gengsi gak usah ikutan gaya kekinian yg penting rapi #gajiangakbabalas",dinata_eva
658,"@yoniko91 @rismaadista @Lutfiana_K Ga ada diskon bu, sudah harga pas.",indiraharini
659,hello kakak ada yang baru nih dan diskon 10 %  my bottle kaca + sarung + saringan teh wah komplit sekali yaaah  my bottle terbaru ini memiliki bahan kaca dan mempunyai saringat teh di bagian bawah nyaaa... https://t.co/gSn05KsuU6,Tiff_houseware
660,Shopee nih kebanyakan diskon tapi sering eror sama aja aq susah dapet diskonnya :(,Alivasz_
661,"Berbagai diskon dan program menarik menunggumu!  Yuk datang dan kunjungi Pameran IT terbesar di Indonesia : Indocomtech, 31 Oktober  4 November 2018 di Jakarta Convention Center.  #Indocomtech #Indocomtech2018 #JCCSenayan #Jakarta #terpopuler https://t.co/Q7gGDmIrs3",inilahdotcom
662,Nike Court Royal Grey Size 43 / 27.5 CM BNIB Harga retail : 1.099.000 Harga diskon : 500.000 ORDER LINE @ : @ghs5745r ( pakai @ https://t.co/NLzqF9DwZt,AjiGiriantoro
663,"NT 98006 DONUT HOUSE SCENARIO  Weight : 0,24 Kg Dimension :length 22cmwidth 6 cmheight 18 cm Pieces :116pcs  Price : Rp. 120.000 diskon 35% menjadi Rp. 78.000 SELAMAT SIANG GUYS https://t.co/4LzRQz5CuK",Funbrick_KRWC
664,"Nantikan ""IKOMA SHOPPING DAY"" tanggal 11 bulan 11 (November). BIG SALE BIG SALE BIG SALE  Telp/WA 08116540877 https://t.co/AnyvPZFbeN  Nb: Ikoma Indonesia tidak pernah memberikan diskon dengan menaikkan harga produk terlebih dahulu seperti yang lainnya. #harbolnas https://t.co/UVCsIWkIpV",ikomaindonesia
665,"Saatnya manjakan diri anda dengan aneka koleksi terbaru dari Ceria (Pasar Atom Tahap I Lt, 3, BA 70). Dapatkan diskon khusus aneka pakaian wanita mulai dari 50K. https://t.co/8P0tqSEMWl",pasaratom
666,"Pilihan partai boleh beda Pilihan Mobil TOYOTA aja Bulan ini, bulan paling untung beli TOYOTA DISKON nya Besar DP nya Ringan HADIAH nya Banyak* UNIT nya Ready* Yukk buruan Pesan TOYOTA nya Sekarang, Hub DIMAS ADHITYA 0821.6520.2000 https://t.co/oPEvci1uOX - MELAYANI DENGAN HATI - https://t.co/NRRcUYgslz",dimasadhtya
667,"{NP} DISKON KHUSUS AKHIR TAHUN! Silakan lgsg cek Shopee   Ready Stock cleanser dan toner (Cosrx, Cetaphil dan Senka) yg dicari-cari   Harganya lebih murah dari di store!  Shopee  GO-Send  https://t.co/rByD0rEU1Z",New_preloved
668,"Min @myXL tadi saya liat di *123# ada diskon 20% untuk pembelian kuota 35 gb. Nah setelah saya isi pulsa, promo diskonnya jadi hilang ya? Yang salah siapa ya?",jumtankaje
669,@educationfess Oiya kalau ada yg mau beli paket ruangguru 1/2 th pake kode referral ku noraakjvvq bisa dapet diskon :) :),noyaaaj
670,"Evalube Hadir di IMOS 2018, Ada Diskon 20% https://t.co/iIYQ5tu498",temponewsroom
671,"Evalube Hadir di IMOS 2018, Ada Diskon 20% https://t.co/lChIxurK2S",korantempo
672,"Evalube Hadir di IMOS 2018, Ada Diskon 20% https://t.co/zzSOnT1n8w",tempodotco
673,Persamaannya adalah... Sama-sama lagi diskon s.d 1 juta (ada 50 rute lho!) Oke banget kan buat liburan akhir taun?   Buruan cek kode kupon tiket pesawat di sini https://t.co/lxDEHY1O3O https://t.co/Lr9NhyfpnV,traveloka
674,"grup orang rumah gue ramenya klo ada voucher diskon sama info anak anjing doang, giliran ngabarin pulang malem sama nanya barang kaga ada yg bales ckck",krezy_kresen
675,@secawanmaduu apa makna nya diskon 1%,tehdumdum
676,Simak bagaimana Google mampu menelusuri kompleksitas perjalanan digital oleh Suresh Mylavarapu di #gdpicon2018!  Gunakan kode promo KUMPARAN20 untuk penambahan diskon! https://t.co/uudkL9ymSD https://t.co/JytReWnBGz,kumparan
677,"Harga spesial untuk Tommy3 Plus, Wikonian! Jangan ketinggalan, retweet dan sambangi link berikut ini! https://t.co/O7GNMvzM8H #NOSIMCARDNOWIFINOPROBLEM #WikoID https://t.co/8TJwEoL0IT",wikoindonesia
678,Hhhhhhjirrr diskon jd 185k dong tdnya 300k lebih https://t.co/9mkaUxempz,danielfangirls_
679,Ini Dia KUPON HEMAT SPESIAL NOVEMBER - DISKON HINGGA 40% dari BURGER KING | Yuk buruan dicek dan didownload biar jajan kamu makin hemat | Lihat selengkapnya disini https://t.co/WLv6O0RCuA,katalogpromosi
680,@BankSinarmas Pastinya harus menggunakan uang sesuai anggaran bulanan yg sdh direncanakan. Jangan tergiur oleh promo2 atau diskon. Karena itu bisa membuat Anda gelap mata. #gajiangabablas  @fiqriimamah @niasudiro14 @a_lhien23 @UmiUlayah @_ULuQ_,wina_win15
681,Gamis Friska 289k all size  PROMO Ceria Buat NOVEMBER  Untuk order sebelum launching  Only gamis Diskon 5%  1 set Gamis + Khimar Ameerah 10% (Yg dpt diskon gamis dan ameerahnya)  Semoga https://t.co/d8hcW0pOCW,Iis200310
682,"Kunjungi Farmers Market Kota Harapan Indah Living Plaza dan temukan berbagai promo dan diskon menarik. Nikmati harga lebih hemat untuk pembelian produk-produk berkualitas berikut, selama periode pembelanjaan 2 - 8 November 2018. https://t.co/fyO7BzQeAW",FarmersMarket99
683,"@WannaScience mar, lap diskon dimanasihh aku dari kemarin liat tweet pada bilang diskon tp gak tau dimana :"")",kingsjaehwan
684,"Galau ya Allah :"") Kihno beneran godain aku Mar, kamu gak biasanya gini.  LAP daniel juga lagi diskon  Udahdihujat sama temen biar jangan riya jangan mubazir tapi tetep au ah :(",WannaScience
685,Diskon Tas serut Bucket bag Tas selempang wanita fashion korean style Berkualitas - https://t.co/oBSpp00el1  #NewArrivals #Indonesia #jual #jualan #jualonline #jualmurah #jualanku #jualanonline #jualankaka #dijual #diskon #diskonbesar #NoHoax https://t.co/q4k9SgOboK,store_ta
686,"Hari ini lebih besar, lebih ramai, lebih banyak diskon, dan banyak hadiah! C U Indocomtech PlayStation Asia PSe Gameshop",psegameshop
687,PREDIKSI TOGEL SYDNEYPOOLS JUMAT 02 NOVEMBER 2018  AS : 1/2/6 KOP : 7/9/5 KEPALA : 3/0/6 EKOR : 1/5/8 ANGKA IKUT : 0/2/9 COLOK BEBAS : 6/7/1 CONTROL : 6/8/3 HOT 2D INVEST LINE : 0/3/5/6/7/8 (60 LINE)  Dapatkan info cepat dan diskon besar pembelian togel di https://t.co/Zak9l4YSPd https://t.co/EbzqHnF5lE,turbo4d
688,"@rlthingy donlot appnya, bikin akun, masukin kode akuu NQWW26 trus dapet diskon deh",plumptish
689,@sylverispell @womanfeeds Travel*ka sis. Tp tergantung harinya. Kalo weekend gini emang naik jd 300an. Kmrn booking hari senin dpt 230rb trus dpt kupon diskon dr travel*ka nya 25rb jadi cuma 205rb.,adlapp
690,"Barang baruuu. Masih anget nihh, tengok yuuuu.Kode : high heels kece Harga : 115.000 Size : 36-40 Yuk diborong guysss! Beli banyak dapat diskon :3 https://t.co/6i1h51fNxy  profiklan iklanOnlineShop",SepatuDocmartku
691,@nctsnajemin Sungguh tidak seru. Diskon deh??,Jung94L
692,"Dear customer, khusus hari ini utk pelanggan yang cakep dan sopan diberi diskon seribu rupiah per item yak. Thx.",3continental
693,@dygx_ @CindyPraaa Hahaha racun diskon tuh ya emang menggoda iman ,vinnyalfnitmi
694,"Paket liburan ke #Hongkong murah!  4 Hari 3 Malam ke Hongkong cuman 7,5 juta-an per orang! Diskon untuk anak dibawah 12 tahun.  Harga paket sudah termasuk : - Tiket Pesawat Garuda https://t.co/YlcEnLCWfP",nguraheka
695,@AetraJKT Klw terlambat langsung segel klw terlambat pasokan air diskon 50% yaa. Adil dong,mqdafi12
696,Yuk di cek Katalog GIANT EKSPRES PESTA DISKON periode 01-30 November 2018 | Temukan berbagai penawaran spesial selama bulan NOVEMBER 2018 | Informasi selengkapnya disini https://t.co/fxCj4ZLiaV,katalogpromosi
697,Saya menjual tas selempan... seharga Rp220.000. Dapatkan produk ini hanya di Shopee! https://t.co/69QBWCmHFR #ShopeeID https://t.co/uEtrxACCqs,jerrygunawan006
698,"Dua maskapai ini memberikan diskon 20% bagi pengunjung eco green park, Apa saja syaratnya? https://t.co/pW9UdPAkMo  #ecogreenpark",ecogreenpark
699,"SPESIAL BANJIR DISKON NOVEMBER!!! Yang kemarin ketinggalan promo spesial, Nih Elshinta elektronik ada promo spesial lagi. Jangan sampai ketinggalan dan kehabisan.. Stok terbatas!!! Langsung amankan.  Info... https://t.co/IuVCL76ost",pekalongan_info
700,"SPESIAL BANJIR DISKON NOVEMBER!!! Yang kemarin ketinggalan promo spesial, Nih Elshinta elektronik ada promo spesial lagi. Jangan sampai ketinggalan dan kehabisan.. Stok terbatas!!! https://t.co/6rwnmKOw0L",pekalongan_info
701,Semi Annual Sale up to 40% OFF!  Cek segera koleksi sepatu hingga aksesoris di Payless ShoeSource terdekat di kotamu untuk memiliki style terkini dengan diskon terbaik!  Promo hingga 13 https://t.co/dXYfOpmRPg,pentacitybsb
702,"READY STOCK ! PAKET PENINGGI BADAN, PAKET PELANGSING, PAKET KECANTIKAN FREE ONGKIR UNTUK PENGAMBILAN DUA PAKET PLUS DISKON KHUSUS ! BURUAN ORDER ! PIN 51AB74C7 WA 087885546800 SMS 089605805256",anitasherbal
703,DISKON ALL-ITEM UNTUK PEMBELIAN VIA SHOPEE !! https://t.co/o8gSRVQVJx https://t.co/o8gSRVQVJx,SweetbearsCo
704,#fotograferbirthday #jasafotografer #jasafotograferjakarta #ACARANATAL #ACARAKANTOR #jasafotomurah #jasafotoanak #jasafotoulangtahun #jasafotografi #jasafotoultah #jasafotojakarta #jasafotoultahanak  PAKET JASA DOKUMENTASI FOTO DAN VIDEO MURAH DISKON 20% - https://t.co/lPYRy4FqnD,bwellphotovideo
705,@gyeotta Diskon nya 5% aja doong.,baecjinyourg
706,"[askmf] mending beli di traveloka diskon 15rb, atau di tiketcom tapi diskon 20rb? mau di tiketcom tp aku masi gatau sistemnya sm kaya traveloka atau ngga:(",askmenfess
707,"@spacetaem padahal aku sering pake tp blm dpt diskon jg --""",DeviApril97
708,"Pesta Diskon 11.11 atau 12.12, Mana yang Lebih Diminati? https://t.co/oDdL1pWNfK",KATADATAcoid
709,@pieroindonesia min sepatu Jogger rs premium evo kena berapa diskon di Jakcloth solo? https://t.co/5j8mnLcW8y,Sky_Blues1894
710,@nona_tintin1 hahah berarti nafsu liat barang diskon lbh besar dri pd liat cwo ganteng ,vikar_rockes
711,"Wajib tonton , Salim bib.  *bantu promosiin akun youtube biar saya dapat diskon klo beli buku https://t.co/vlRVr8aSpL",_Sai_ful
712,Makin seru nih.. OVO vs Go Pay vs DANA. Yuk ayuk obral diskon teruss,kurniawankukuh
713,"@gojekindonesia 10 vocer go ride 2 vocer diskon di Menteri Indonesia, Tebet Jaksel 1 bocer go pulsa  Dan baru terpakai yg gocar ;)",DianVeei
714,@nona_tintin1 kalo ada cowo ganteng di mall yg lg diskon 50% gimana?! hahaha.. :D,atsahkarp
715,Dapatkan diskon 30 % dari Kimochi Me di Lazada ketika kami pakai voucher promo ! Kumpulkan sekarang voucher nya dan siap siap diskon menantimu di campaign 11:11 !! Buruan Kimochi Lovers ^^ https://t.co/1FmUwmBA08  #voucherlazada #promo #diskongede #diskon #bajumalam #juallingerie,kimochime_sexy
716,Dapatkan diskon special hingga 80% untuk pilihan sepatu cantik dari Farish yuk! Beli Aja:. #MatahariMall,roslisye145
717,"Promo Oktober Annual Pass 290.000 sampai tanggal 11 oktober, Promo STNK Motor diskon 50% dari tanggal 12 Oktober-13 November 2015. Trims.",Dufan
718,Daftar Hotel Diskon di Surabaya https://t.co/Rv7yJ6tWKZ #hotel #surabaya #infohotel #hotelsurabaya,pwidiinfo
719,AKU INGIN MENCINTAIMU SEPERTI PRINGLES KEPADA DISKON'AN,randy_kempel
720,Sendal jepit ku terasa lebih elegant dianatara hils pemburu diskon,JulianaJangs
721,"Dowoon   modal dong di mah pake Tossa selain sayur dia jg jualan gas 3kg wkwk  plus jasa masangin tabung gas Udh ada bandrol harga jd ga usah bnyk nanya mahal bgt nih petenya?! ya udah sy diskon 5% krn ibu langganan dy buibu sibuk belanja, dia ngegame  https://t.co/3zrOy0dvNJ",n_agustinaaa
722,3 days sale hanya 3 hari saja 2-4 nov 18 Nikmati promo diskon 10 % untuk semua produk harga normal dan khusus unruk member Ace Rewards Tunggu apa lagi Hanya di Ace Hardware Epicentrum https://t.co/3tDDCYDSYb,LEM_Official
723,@bellabrigitaa Di malaysia lg diskon bel. 420k dapat 3x500ml,anissabilfaqih
724,"Pesta Pencinta Buku Sastra, Gramedia Veteran Banjarmasin Berikan Diskon Hingga 2  https://t.co/q8fn6Ey6VE",banjarmasinarea
725,"Temukan peralatan masak berkualitas dari brand favoritmu seperti Yong Ma, Kirin dan Sanken dengan diskon hingga 50%, flash sale 2x dan voucher hingga 150RB cuma HARI INI di https://t.co/zwrZJkZEIS Cek promonya disini https://t.co/LqoRuaY8Vy #jdid #bestkitchendeals #dijaminori https://t.co/1MXRDHJLcx",JDid
726,Dapatkan Diskon Semua Produk Otomotif Besar-besaran di Harbolnas https://t.co/yIpFBnXssd https://t.co/nQbHHxZxHv,dedisuparman87
727,@GisellaCik @Twit_Opini @Irenecutemom Mumpung masih ada umur itu di mall ada diskon 90% lumayan,zaenaltea3
728,Rayakan Grand Opening FLIX Grand Galaxy Park November ini!  Diskon 15% @VanLanda Kettle Chips / #hydrococo.  Mari rayakan bersama di bioskop FLIX di lantai 2 @ggpmall Bekasi!  #GrandOpening #FLIXcinema #ggpmall #ggpmallbekasi #bekasi #grandgalaxypark #bioskop #Promo https://t.co/taTnGY3MBq,FlixCinemaID
729,Beli perdana XL Xtra Fun diskon 5ribu. Dapatkan di Indomaret selama periode 16 Oktober - 30 November 2018. #Indomaret https://t.co/LExWmzByhu,Indomaret
730,"Banyak Diskon di Stand iBox Indocomtech 2018! Ayo kunjungi stand iBox di Indocomtech 2018, Hall A-A3B, Jakarta Convention Center.  Diklikaja tautan ini: https://t.co/JRsC3EHlcO  #DiKlikAja #Pameran #Indocomtech2018  #iBox #OptimuZ #PQI #Alto #Kajsa #nmaxn #Apple #Indocomtech https://t.co/SBtBSlxagc",DiKlikAja
731,"TRIO PANGERAN BIRU Hayu luur, Kita ramekeun PERSIBDay lurrr, dapatkan diskon:  1. Jersey PERSIB Original Authentic 2018 diskon* 10% 2. Jersey PERSIB Original Replica 2018 diskon* https://t.co/0bjPCgSa79",Store_Persib
732,"Ketika beli baju karena diskon, sampai rumah ternyata udah punya, ya anggep aja stok deh... #ripmymoney",maharaniputrio
733,"Gegara abel cantika nih :( tapi foundie lama masih ada, yg ultima ini pas diskon :( bingung akutu :(",anggiieelorita
734,HARGA PROMO ========================== KAOS DISTRO  GRADE ORI ========================== PRICE : HARGA DISKON Rp.65k/pcs  Spesifikasi Kaos : - Cotton Combed 30s Original 100% (High https://t.co/zAQQFdPBpi,ceksbeibeceks
735,HARGA PROMO ========================== KAOS DISTRO  GRADE ORI ========================== PRICE : HARGA DISKON Rp.65k/pcs  Spesifikasi Kaos : - Cotton Combed 30s Original 100% (High https://t.co/72HCI1jnOO,ceksbeibeceks
736,@svmmerdoxe @Westerns_SQ Beli nya pas diskon aja,Archrivalz
737,HARGA PROMO ========================== KAOS DISTRO  GRADE ORI ========================== PRICE : HARGA DISKON Rp.65k/pcs  Spesifikasi Kaos : - Cotton Combed 30s Original 100% (High https://t.co/rv0G89HCiE,ceksbeibeceks
738,HARGA PROMO ========================== KAOS DISTRO  GRADE ORI ========================== PRICE : HARGA DISKON Rp.65k/pcs  Spesifikasi Kaos : - Cotton Combed 30s Original 100% (High https://t.co/u3bQcXLeIf,ceksbeibeceks
739,diskon pembelian https://t.co/Qdg8cbFm5B,okproductionhou
740,Yes! Dapat produk diskon yang diincar di toko online langganan. Happy banget karena dari dulu udah mupeng sama si HDD 2TB. Sekarang file - file penting bisa tertata #JadiLebihBaik di hard disk baru. Memang ya dengan sinyal penuh @XLAxiata_Tbk semua bisa dijangkau dan didapatkan.,VinaEska
741,BIG BAD WOLF BOOK SALE MEDAN DIBUKA HARI INI! Kunjungi bazaar buku terbesar dg diskon 60%-80% untuk semua buku impor. Buka 24 Jam nonstop mulai 2-12 November 2018. Gratis biaya masuk gedung!  Aku tunggu kedatanganmu di sarangku Wolfies Medan! #auuwsome #BBWMedan2018 #mandiriBBW https://t.co/meT4GxMSm2,BBWBooks_ID
742,Dapatkan promo diskon sampai 70% di TSM Bandung! Klik info detilnya dibawah. Jangan lupa buat retweet ya ;D https://t.co/GAp1Ugvvqe,TSMbandung
743,"Hi, gunakan kode berikut ini elfiraX5FUN8W3DX untuk mendapatkan diskon pembelian paket ruangbelajar di Aplikasi mobile @ruangguru",Elfira_rhmnia
744,"@adylaeka Promo Redemption penukaran tiket diskon 30%, 50% dan 70% pada Program GAMiles Fest berlaku untuk periode reservasi hingga 30 November 2018. Terima kasih.   - Janet",IndonesiaGaruda
745,"Nah siapa nih yang sudah nungguin diskon di MAP? Cardholders, diskon MAP kali ini hingga 50% loh. Yuk kapan lagi kan? Langsung gunakan #mandiricard dan nikmati diskonnya #mandiripromo https://t.co/9oWxw9g4up https://t.co/68azTfPPRQ",mandiricard
746,"IMOS 2018: Pertamina Tawarkan Pelumas Setengah Harga - Di IMOS 2018, Pertamina Lubricants memanjakan pelanggan setia Pertamina Enduro dengan memberikan promo spesial yakni diskon sampai 50 persen. https://t.co/GMPjSwTY4e https://t.co/T6DHiRRiR7",capumoni_
747,"OCTOSAVE dari @misteraladinID DIPERPANJANG lho! Kamu bisa nikmatin diskon s.d 15% (maks. Rp1,2 JUTA) untuk semua hotel di Mister Aladin sampai dengan 04 November lho. Tunggu apalagi? Ayo, pesan SEKARANG juga! CEK: https://t.co/NVanG9o7R1 https://t.co/p5eRnIJJLZ",MNCPlayID
748,"Parfum mini giordani &amp; posses diskon lagi  Kemarin ga sabar bgt nunggu web buka karna mau order parfum mini ini,takut kehabisan  Parfum mini ini wanginya sama kyk parfum ukuran biasa tp dikemas mini biar... https://t.co/MuMvXWn4dt",chris_dhey
749,"Bookmanias, jelang #HariPahlawanNasional #SeriBukuTempo dan beberapa buku sosial dan sejarah KPG diskon 15% di @gramediadotcom. Periode Promo 1 - 10 November 2018, tanpa minimal pembelian. Katalog lengkap: https://t.co/85lfjhSMyq. https://t.co/BbHzONL43i",penerbitkpg
750,HARGA PROMO&gt;&gt;SLIDE ========================== KAOS DISTRO  WASHING ========================== PRICE : HARGA DISKON Rp.85k/pcs  Spesifikasi Kaos : - Cotton Combed 30s Original 100% (High https://t.co/wDuu6Zj8V1,ceksbeibeceks
751,untuk info dan pemesanannya bisa tanyakan langsung ke WA 08116400164   *diskon 15% + free ongkir seluruh Indonesia   see ya  https://t.co/nWQzOE0l0S,WelisariP
752,"Ok, wait yaaa, saya mau booking hotel ke Jogja dulu. Mumpung baru dapat notifikasi ada promo diskon ^^ #JogjaIntlHeritageWalk",melfeyadin
753,"@KjtiOfficial ya siapa tau tergugah punya jersey timnas terbaru dengan diskon lumayan kalo itungan jersey fresh, tinggal 700an tuh... https://t.co/2Q59tcOk3n",A_Rakhman
754,@butteurfly Diskon 60% dong ,trauruss02
755,"Matahari lagi diskon, Langit selesai ngambek.",sulistyodanang
756,katalogpromosi: Buat kalian yang bisa jajan di ALFAMART - Yuk di cek dulu Katalog Belanja ALFAMART Periode 01-15 November 2018 | Mana tau ada diskon buat produk yang lagi kalian pengen beli | Lihat yuk selengkapnya disini https://t.co/xcBjlOXusi,zuvliet
757,"Belanja terus""an di BAZAAR RAYA Rekening Ponsel Banyak dapet keuntungan , selain dapet diskon 50% Bisa juga Menangin Wheel Of Fortune , bisa juga kita narsis di photobooth, yuks ramein https://t.co/AhY6RQpNJ2",NovitaHermayaS
758,Buat kalian yang bisa jajan di ALFAMART - Yuk di cek dulu Katalog Belanja ALFAMART Periode 01-15 November 2018 | Mana tau ada diskon buat produk yang lagi kalian pengen beli | Lihat yuk selengkapnya disini https://t.co/tqA8sL8MQk,katalogpromosi
759,Hmm spao x sailormoon udah mulai diskon. Beli yg harpot entaran aja ah,intansf7
760,@Detrackzone DIH aku anak apa aja yg penting diskon kak,araaichi
761,@PTJASAMARGA Harusnya tol digratiskan atau diskon jika ada pekerjaan fatal,yunanto41
762,"indonesia darurat membaca.  slogan ""Reseller diskon 30rb"" dibacanya ""harga 30rb""",annisaanl
763,"Hi Tomkiners, ada diskon nih dari Tomkins di akhir pekan periode 2 s/d 4 November 2018 khusus di Ramayana. Diskon 20% untuk Tomkins Venom, Seeker, Wexler, Rabbit, Phoenix, dan masih banyak lagi artikel keren lainnya. Buruan, kunjungi counter Tomkins di Ramayana sekarang juga! https://t.co/JYIfIGUmX6",myTOMKINS
764,"@jokowi Mungkin yg punya lapak bakal adain diskon, stay tune aja di chanel ini",barcelonaandik1
765,Nikmati diskon 30% dengan Maybank Kartu Kredit setiap hari Jumat di Devon Caf.  Informasi lebih lanjut: https://t.co/oYEnHS2j3H https://t.co/Sxrs01Tw13,MaybankID
766,Nikmati diskon hingga 25% dengan Maybank Kartu Kredit di Coca Suki.  Informasi lebih lanjut: https://t.co/Ls0Kadfpiq https://t.co/Lxn4B1pCZE,MaybankID
767,"@fayaraa Betul betul jadi sekonsumtif ini karena online shop  soalnya kalo belanja di toko harga normal kyk sayang ajaa gt, giliran diskon dikit di online shop langsung sikattt kyk kapan lagiiiii ",nitaanur
768,@muorphin @ireuvn Udh gua ksh diskon,ohxshunn
769,"@hices_ @infomalang Tegal ndeso ada di ig.. besok baru opening, yg punya temenku sendiri,diskon 50% besok https://t.co/BrSROuSiQ4",firdaadilla
770,LG Q6+ hadir hadir dengan dimensi baru pada pengalaman melihat smartphone. Dilengkapi IPS Full HD FullVision terbaru. Miliki sekarang dan dapatkan diskon dan bonusnya. Klik https://t.co/rF7hopkcYk https://t.co/CIy2yFTzeo,DINOMARKET
771,Parfum dan handbody Harumnya lembut banget  Handbody tapi wangi nya kayak wangi parfum Yuuk order mumpung lagi diskon 30%,tHatHa_131196
772,Nikmati diskon 30% dengan Maybank Kartu Kredit setiap hari Jumat di Devon Caf.  Informasi lebih lanjut: https://t.co/oYEnHS2j3H https://t.co/sQ90I10QQs,MaybankID
773,"Peringati HKN, Prodia Blitar Beri Diskon 20 Persen https://t.co/NrXgDoMHVi",jawapos
774,Nikmati diskon hingga 25% dengan Maybank Kartu Kredit di Coca Suki.  Informasi lebih lanjut: https://t.co/Ls0Kadfpiq https://t.co/SRI2parwfn,MaybankID
