,0,1
919,"@BankSinarmas Dahulukan kebutuhan pokok &amp; cicilan, sisanya 10% ditabung guna keperluan dadakan. Beli barang pake kartu debit aja, krn biasanya dpt diskon, lumayan buat ngirit. Belinyapun karena manfaatnya, bkn terpatok brand-nya yg terkenal buat gayaan #gajiangabablas @nyuuncyg_wie  @roshma_",Roshma_
920,@Nugraagungp @rlthingy Sering dikasih diskon soalnya wkwkw,LovablePotatoes
921,Gembar gembor cashback shake shake badai uang eh yg di diskon cuma sabun colek. Kambing.,fachrezardian
922,miskin level: liat-liat barang di toko mahal sambil pura-pura buka hp balesin chat padahal lagi buka kalkulator ngitungin harga setelah diskon eh tetep aja duitnya gak cukup ,ririnriandini
923,"@ShoutOut3Sub &amp;&amp;.     ""Ada diskon tidak, buat yang sering datang ke sini?"" Ia bertanya kepada seorang puan di belakang mesin kasir.",penetrage
924,Aku suka diskon dan cashback,hananhas1
925,Jangan lupa gunakan @KartuKreditBCA Visa &amp; Mastercard setiap berbelanja di https://t.co/T46wi9x35x untuk menikmati #BCAOnlinePromo diskon hingga Rp 200rb untuk semua produk setiap harinya hingga 31 Des 2018. https://t.co/tvBNvE7Gly,KartuKreditBCA
926,"Karena hari ini hari Jumat, nih saya kasih promo hemat :  2 bioglass diskon 300 rb, masih dapat FREE kalung pendant",sellyriantica
927,"@dsyprtw Sebel banget, diskon disaat dompet kering :(",_maulinawt
928,@ummtlfrdsy napa maneh alhamdulillah :( kata aing ntar 11.11 ga akan diskon juga barang yg aing mau :(,ailuropiel
929,Geoff-Max lagi banyak diskon neh yaampun,ElyaAndhika
930,Yuk pilih deodorant kesukaan kamu Diskon gede lo...,Alsa_eva
931,Diskon bayar internet bulanan? Siapa yang bisa menolak? Cukup scan QR Code kamu di Fasternet dan dapatkan diskon 10% untuk semua transaksi! #YUKKpakeYUKK https://t.co/NFP5PVhLaG,yukk_id
932,"Gadis aneh. Nael menggelengkan kepalanya, mencoba ramah.      ""Ah, maaf, puan tapi, kami hanya memberi diskon di waktu tertentu saja."" https://t.co/qCwpDBSaJq",0419NG
933,Diskon besar-besaran!! Beli sepatu yang kiri gratis yang kanan! Buruan sebelum kehabisan. :|,Andialim007
934,"Salut sih sama mba2 indomaret yang ngucapin:  Selamat datang di indomaret selamat berbelanja, kemilau 30 tahun indomaret dapatkan ekstra diskon 20% dan menangkan hadiah mobil  Ke setiap pengunjung yg dateng. Pengen w beliin pocari biar tenggorokannya gak kering",adityanesa
935,"Mending ikut jerat-jerit ini bro, mayan dapat diskon atau juga cashback.. #Tsahhh https://t.co/gX3f1gK1AH",Hakimlfc13
936,"Batch berikutnya skor buat lulus bakal balik normal lg, yg tdi di diskon aja ga lulus apalagi normal",QorinaRahmani25
937,"@rlthingy Kurang tau, tapi lagi ada diskon grilled pork murah di fave. :)",mati8jamsehari
938,"Jika suatu perusahaan terlalu sering dan jor2an kasih promo, diskon dsj, apakah pertanda kurang kreatif, mau decline, over budget, stag, baek hati or what? ",dhoni_chaniago
939,@inkyjulitas Diskon kan,Benjagung
940,@javachipfrappe_ @rrncynth Yuk ke yang dapet diskon map dong susi2 kek,bimkumr
941,"Karena itu, mereka mengemas konsep ""wisata kesehatan"" dengan memberikan sejumlah benefit seperti diskon pesawat, free shuttle, hotel, dll. Menguntungkan banget buat Malaysia.",agagagaga
942,"@faucetwater Iya ya aku lupa,pantes weh diskon semua gini Aku tidak instal apk belanja online sm sekali. Sengaja",glorytys
943,"@fedriansyah_ Engga euy, sendal gue merek nya Ando itu beli di pasar diskon 50% jadi 23 ribu. Makasih",HendraaPd
944,"DISKON BESAR, Peninggi Badan Tiens Murah, 100%herbal. #info 29A2D527, PIN 29A2D527 #pekalongan #pati #jepara Jualank ##InfoJatim #Retweet",PeninggiGrosir
945,"assalamualaikum... yg mau harga diskon 50% segera chat saya yaa... grab it fast ! ada parfum, lipstik matte, shampoo anti ketombe, dompet, dll",Baiq_Renni
946,Ragam Diskon Motor Sport di IMOS 2018 https://t.co/NQ6JHMikSf,DeniRahm4n
947,"si Ibu teracuni face oil dan akhirnya beli juga, trus mumpung the ordinary rosehip oil lagi diskon di beautyhaul. Semesta mendukung ",satooriemma
948,kenapa ya awal november ini berasa banyak diskon bersliweran,iyaiyas
949,@w1_bjy00 yodaah diskon deeh/? Kan jaman skrg banyak diskonan wkwk,96joyipark
950,"@wonyhoungi Selamat datang kembali, kebetulan hari ini ada diskon :)",joenjkey
951,@wqwq_jkt48 Dah kelar diskon payday,domonyadomo
952,"Ya Allah, hindarkanlah hamba dari barang diskon yang sebenarnya belum tentu hamba butuhkan.",dimedwin
953,"Yuuuhuuu.... Kita semua lolos dapet Discount BC 50% diluar Diskon Member, bisa beli produk favorite dengan harga superrrr muraah   Jangan lupa yaa semuaaaa  Mba Asti Mursugeng, Santi Majid, Beby Nadine, Erni... https://t.co/Bh4PBClR1J",odnaymaufar
954,@wonomonstax Karna providerku seorang monbebe apakah aku akan mendapatkan diskon ?,lmxnhyk
955,"#mandiripromo RT @mandiricard Nah siapa nih yang sudah nungguin diskon di MAP? Cardholders, diskon MAP  kali ini hingga 50% loh. Yuk kapan lagi kan? Langsung gunakan #mandiricard dan nikmati diskonnya #mandiripromo https://t.co/EaXi2bS1v8  https://t.co/zJopuVmDkc",maswan37
956,@Dindaapr3 Kamu yang beli pertama aku kasih diskon mau kujadikan testimoni,hanastyr
957,"Berbagai diskon dan program menarik menunggumu!  Yuk datang dan kunjungi Pameran IT terbesar di Indonesia : Indocomtech, 31 Oktober  4 November 2018 di Jakarta Convention https://t.co/gFVLaVuHzb",trenteknologi
958,"Hi, gunakan kode berikut ini cindyHX7LTWN4440 untuk mendapatkan diskon pembelian paket ruangbelajar di Aplikasi mobile @ruangguru",cndygqn
959,HARI INI! BLIBLI Promo Permata HEBAT! Diskon Hingga Rp 200.000 dengan Kartu Debit PermataMe! https://t.co/PHUPdxgyn0,katalogpromosi
960,"@BukaBantuan @bukalapak Dapat voucher dr shake a ton... voucher diskon 99%....nah, itu voucher bisa dipakai berapa kali?",momoharax
961,Keadaan Mirota saat hari Jumat adalah gak banget  Thread berbelaja ke mirota pada saat hari diskon ,sofimarinda
962,"Siangnya, dikomporin @fisnaa ada emoney special edition yg lucu parah, lagi diskon. Malemnya di mention ternyata dapet giveaway. Hae    untung kan gak tergoda beli   Terimakasih BPN, sudah sampai ya  https://t.co/82XSBswywj",astripus
963,Baru kali ini interview malah dikasih voucher diskon blanja batik dari HRDnya ,trisnakinan
964,@kriisttps kita lagi diskon nih mas kiw,osehoonxo
965,@neocultrd astaghfirullah ada diskon 3second kmrn terakhir :(,diolenginct
966,@kjbgncd BUKAN GANIAT. LAH RUGI KAK KALO DISKON 100%. MARAH,izonechaewon
967,"Sebenernya kalo pas d kaki ku yaa ga suka suka kali juga tp ga bakal ku jual, memang size nya pas, tp gitu di pake kaki ku keliatan panjang, aku jadi gilo  Karna biasa sepatu ukurannya gak kek gitu, pas mau d beli juga sadar kalo itu agak gede, cuma karna diskon ta tetep d beli",debyparamitha_
968,"@adimpil Aku di carrefour. Karena diskon 10%.  Padahal kalo diitung2 mah sama aja kayak Superindo/Naga.  Katanya lbh murah di Hari-Hari, tp jauh dari rumah   *innes, ibu rumah tangga, mau hemat tapi gamau repot*",innesyulia
969,And the story goes on ia jual mahal dan aku tak tunggu diskon,frnshb
970,@svtzgyu gapapa ga diskon juga,chaeion
971,"@gojekindonesia mau Tanya dong, sekarang gak Ada ya voucher yang menggunakan go-points? Trus fungsinya go points apa dong? Percuma ngumpulin points banyak tpi gak bsa dipake. Pdahal penhem buat voucher diskon gofood tpi uda gak Ada lagi :(",theaurorare
972,@askmenfess Yang diskon. Kalau gada yang diskon biasanya caramell machiato,MFHNH
973,@askmenfess Yaampun diskon 90% :( cocok buat aku yg rumahnya sangad jauh,aligatorgozaima
974,@hanuputra Borong UNVR tuh lagi diskon parah. Sama sebar di finance ama kontruksi.,rezaihsan26
975,ACE jual dong. Diskon pula. https://t.co/yTWqiDFIz8,0604_0919
976,@bayu_joo Liat barang di olshop lucu diskon terus gratis ongkir tanpa berfikir panjang langsung order lalu bayar lalu menyesal aku kan ga punya duid lagi kenapa aku beli beli :''),PietaReynata
977,Promo brand xxx buy 1 get 1 Brand xxx diskon 30%  astagfirullah cobaan,BellaaSaf
978,@osehoonxo wah asiq diskon wkwk,kriisttps
979,"Liat barang yang di pengen diskon di Ace Hardware, di liat baik baik, di hitung setelah potongan diskon nya, di tanya in sama mba mba nya, di pikir, setelah itu pergi tanpa membeli dan menggerutu dalam hati : https://t.co/z1lkOjlo9O",yandypri
980,"Tadi gw ke minimarket dalam rangka abis dikirimin duit sama bapake. Ya Allah lagi banyak produk yg diskon, seneng bgt lah anak perantauan ini ",nndddfa
981,hai hai hai... HOT NEWS GAES... yuuks cuuus ke https://t.co/0bD1dsotn3 banyak diskon loooo dan ada voucer belanja juga... SERIUS GAK MAU ORDER??? JANGAN NYESEL LOOO YAAAA https://t.co/0bD1dsotn3,Vidiana03
982,"@ayurizki_ diskon dimana-mana, ku ingin belanja.",ndaristiani
983,diskon khusus 11.11 : &gt; https://t.co/rVrMsBhoue,jihoonyaw
984,yaallah LAP lagi diskon dong di koreanya huhuu pgn hoodie daniel yg pink,godchoding
985,@Wannable_twts Aku masih ada nii panwink 35k/PC beli lbh dr 1 aku kasi diskon,glooomyorchid
986,"Datang ke @bbwbooks_id Medan seramai ini. Luar biasa antusias minat baca warga Medan   Bazar Buku International mulai 2-12 November 2018.  GRATIS!  Diskon buku up to 60-80%  Lokasinya di Bandara Polonia, Gedung Andromeda.  #FotodiBBWMedan2018 https://t.co/mZ4jEdY27r",agnesiarezita
987,"Datang ke @bbwbooks_id Medan seramai ini. Luar biasa antusias minat baca warga Medan   Bazar Buku International mulai 2-12 November 2018.  GRATIS!  Diskon buku up to 60-80%  Lokasinya di Bandara Polonia, Gedung Andromeda.  #IGKreasiBBWMedan18 #FotodiBBWMedan2018 https://t.co/zbFXyBCxRL",agnesiarezita
988,"Awal bulan itu  Identik dengan lomba diskonan Nggak percaya.... ? Cek aja ! Udah ada tuh sampe diskon 70% + 30%.  Ini biasaya serbuan para ibuk2,mbak2,cewek2",laluwahyurp
989,Hi LoFriends! Mau dapat diskon tambahan 15% ? Yuk segera daftarkan kartu kredit BNI kalian ke Customer Information Service LotteMart! Hanya 1 Hari  Tanggal 03 November 2018! Syarat dan Ketentuan https://t.co/3tamERU4Db,lotte_mall
990,"@Jung94L oke diskon hyung, 1% :)",nctsnajemin
991,@ichund_No Kalau mau diskon hub sendiri @aremadesign @OficSam ,resifl
992,@New_preloved Lagi Ada Diskon https://t.co/xmncx68ZFw,bbyzavariel
993,LAKUPON Promo Potongan Diskon Rp. 15.000 setiap hari Selasa dengan Rekening Ponsel CIMB Niaga https://t.co/RnaFzDecFv,katalogpromosi
994,"[idm] guys yg mau beli masker mediheal x bts di watsons lg diskon tuhh, cus diangkut @BTS_twt #MTVEMABiggestFansBts",indomymenfess
995,@jasnagori emang paling bagus. ntar kuliat apakah dia diskon,etanastea
996,@indomymenfess @BTS_twt Diskon jadi brp?  #MTVEMABiggestFansBTS,CartoonizedFace
997,Mama gue ngirimin ini di grup dikirain dibeliin ternyata dia cm forward dr tmn2nya krn katanya lg diskon sampe tgl 5. Sigh/ https://t.co/T334i30yBB,jooniewish
998,Cece : me aku nanti ngemall mau titip apa? Meme : bulan ini aku ga beli2. Bokek. Hemat. ~~~~telp bunyi~~~~ Cece : me kaos uniqlo senenganmu sing bahane enak diskon!!!!! Meme : sumpah?? Yowes titip 2 ya.  PENYAKIT @cathalvi,meganitars
999,Hi Guy Intip yuk shopee kita Lagi banyak diskon lol   https://t.co/S70mQ3b8cZ  JY Collection 1st hand importir bag fashion  yg berdomisili di Batam. Bag import yg kita import rata2 bagus2 lo stylenya ... https://t.co/DjEdWdfzuO,joycylin407
1000,"@jungamrita aku juga! lg musim diskon bgt mau akhir tahun. dompet tipis, atm tinggal brp digit tp bawaannya pengen beliiiii terus",gudgalwidy
1001,THE DUCK KING Grand Indonesia Promo Diskon 10% dengan G CARD | Lihat informasi dan penawaran selengkapnya di https://t.co/45k6xjLzAr,katalogpromosi
1002,"Wih, ada paket buku bagus tapi murah, Luuur... Sudah diskon besar, dapat bonus buku lagi. Ntap... silakan digaaaas... di @mojokstore https://t.co/epN4MDKYBj",Puthutea
1003,Buset itu gampang banget saling laknat.  Lg diskon kali ya~,Engko_Henry
1004,#initalkshow udh abs aaaa cpt banget kurang lama yaa klo ada wilver jamnya ditambah pst lbh seru  okee waktunya skrng liat koleksi wilove dl yuk edisi #Wiloveweekend diskon lagi 50% jd https://t.co/jPthth7ACY,aai_nely
1005,"Mau makan sate :"" mumpung dapet diskon go food.. :""",_JongFairy
1006,@meganitars HAHAHA DISKON SENYUM MAS NYA,cathalvi
1007,"Info diskon sport station dong guys  Yhaaaa aku memang pengen nggaya tapi modal diskonan, mau apa lo -_-",sellyfidiaa
1008,"Yang mau pesen ini. Buruan DM, aku kasih nomer WA. Langsung aku kasih no rek dan aku pesankan. Soalnya stocknya udh mulai pd menipis  mumpung diskon. Kapan lagi diskon segini kan https://t.co/CxYapeVfbI",nawannass
1009,@Ms_MarciaJoe Gak buk yg diskon lipensetip ama aksesoris,adabinacindina
1010,"Mau beli LAP mumpung ada diskon, trus liat total harga dalam rupiah,, OMG sayang duitku.. hahahaha",NiaNyel7
1011,Pembelian min 3 diskon 2000 . . Info dan pemesanan: SMS/WA: 085755933116 DM IG : @CMCcitra  INBOX FB: Wintra/ Citra Axeza . #wintra #wintracmc #kediri https://t.co/FMbKH027WP,CMCcitra
1012,Gabung di Grup Hematku dan dapatkan diskon spesial! https://t.co/3bcRddXaoa https://t.co/iw8bBiDVOn,hamttayo
1013,@adimpil Saya team mirota kampus kalo weekend ke superindo soalnya banyak diskon,ditaakp
1014,Pembelian min 3 diskon 2000 . . Info dan pemesanan: SMS/WA: 085755933116 DM IG : @CMCcitra  INBOX FB: Wintra/ Citra Axeza . #wintra #wintracmc #kediri https://t.co/4FwskedDdE,CMCcitra
1015,Pembelian min 3 diskon 2000 . . Info dan pemesanan: SMS/WA: 085755933116 DM IG : @CMCcitra  INBOX FB: Wintra/ Citra Axeza . #wintra #wintracmc #kediri https://t.co/JP5V9SQns5,CMCcitra
1016,"@CAWGLOVES Lirik jicucu, mumpung lagi diskon   @LAAAHJISOO   @LAAAHJISOO   @LAAAHJISOO   @LAAAHJISOO   @LAAAHJISOO   @LAAAHJISOO",LAAAHTZUYU
1017,@wikurizky @jijiplot masa idah apa diskon flash sale sih... ga kelar-kelar.,rai_hard
1018,"Diskon up to 90% mulai dari harga Rp 5.000!! Cuma di Big Bang Jakarta 2018, https://t.co/QyYGJUl5qq akan diskon gila2an produk Tomica, Auldey, dan masih banyak lagi produk2 lainnya. . Kunjungi booth https://t.co/Ja9v9WXaEv",bigbangjakarta
1019,Gramedia gamau kasih diskon international best selling books nya apa ya?,pearldallass
1020,"@camomiIeu Tetep w mau hasut, hari terakhir ayo banyak diskon dijamin. Ditambah danilla dan hivi:)",cikopiii
1021,DOMINOS PIZZA Promo DISKON 20%* untuk menu ala carte* (Pizza  Nasi &amp; Pasta) dengan Kartu Kredit BCA | Lihat informasi dan ketentuan selengkapnya di https://t.co/oNy11ejfYi,katalogpromosi
1022,@meilifkiana01 Ehhmmm entuk diskon ki,norma_fitriya
1023,Gabung di Grup Hematku dan dapatkan diskon spesial! https://t.co/XEtsvbSPBx https://t.co/dwZyyL2xoW,dhe01538030
1024,Jual tiket kygo hub wa 085215246090 diskon https://t.co/TDAjxVOY9I,HandokoRuswito
1025,Jual tiket kygo 2 nof live jiexpo Ga 'vip'vvip diskon hub 085215246090 wa,HandokoRuswito
1026,GO WET WaterPark Promo Diskon 50% untuk pembayaran dengan TCASH* | Lihat informasi dan ketentuan promosi selengkapnya hanya di https://t.co/LKzWOiBp1A,katalogpromosi
1027,Yuk buruan mampir ke Grameds.... dan dapat berbagai diskonnya  Bagi anda pengguna BRI Card dapatkan : .Diskon 10% bagi pengguna Kartu Debit BRI dan Brizzi BRI .Diskon 15% bagi pengguna https://t.co/45EZt72hIO,pojokmojokerto
1028,@RPG_94Jinyoung Nextnya nuna dikasih diskon ga nih kalo engga sih ogah ya promosiin usaha kamu &gt;3&lt;,RPG_85LeeHaeri
1029,@rlthingy Diskon kak bukan free minuman setau wegu,rexidwiki
1030,Gerai sepatu offline kini hanya sebagai sarana nyobain size nya aja abis itu beli nya tetep via online.. soalnya pas diskon hehe maaf numpang ngukur sikil mbak.,afriza_aa
1031,"Ada kabar menarik nih #SobatBUMN, mulai 25 Oktober 2018 pemesanan tiket via KAI Access, Contact Center 121 dan web https://t.co/tEOALx6n0B, tidak dikenakan biaya pemesanan tiket dan diskon channel. Jadi #SobatBUMN sekalian bisa mendapat harga yang lebih bersahabat.  #KAI https://t.co/21XpcKJS93",KemenBUMN
1032,Diskon dan dompet tidak bersahabat. Curiga salah satunya kafir,fakyunai
1033,"Resep Omelet Kentang khas Spanyol sekarang bisa lho kamu buat dirumah.   Buka https://t.co/m7LTAGDFtH dan coba sekarang, tambahkan juga sosis @Soesarirokerij supaya makin lezat ya! #  recipe #simplecooking #masakenak #diskon #sale #food #SoesariRokerij #Sausage #Smokey #Juicy https://t.co/pQLIgfD75O",soesarirokerij
1034,"Hari gini masih ribet ke pasar swalayan untuk masak menu favorit kerabat terdekat?   Klik aplikasi @tokopedia di gadget kalian, dan pesan produk @Soesarirokerij favorit kamu disana. Waktu luang lebih banyak deh, happy shopping ya!   #recipe #simplecooking #masakenak #diskon https://t.co/ATEIH47zIN",soesarirokerij
1035,"Diskon 10% untuk sosis spicy dengan cita rasa lada hitam sebentar lagi akan berakhir!   Yang belum kebagian diskon-nya, cek @Tokopedia dan order segera ya. Jangan sampai terlewatkan..   #promo #diskon #masakenak #sosisbakar #food https://t.co/JNWgyviL1B",soesarirokerij
1036,"Coba buat ""Sausage Mini Pizza"" sendiri dirumah untuk hidangan dikala lapar yuk.   Enak dan asik banget lho buatnya, cek https://t.co/P2TK8pGOCj ya!  #recipe #simplecooking #masakenak #diskon #sale #food #SoesariRokerij #Sausage #Smokey #Juicy https://t.co/S5lcKzEcCi",soesarirokerij
1037,Kemeja Fadli Ukuran: tercantum di gambar  Bahan: tercantum di gambar  Harga ecer: 170rb/pcs Beli banyak dapat diskon  Reseller/Dropship welcome  Contact &amp; Order: check Bio  MAAF TIDAK https://t.co/D5GTXynoAH,ria_indra
1038,"@detikcom @wolipop Saya beli kalo diskon dibawah 100rb, kalo gak diskon gak beli.. hayoooo detik mau bandingin apa lagi...",eko319
1039,"Setiap Jamaah Hasanah Tour, mendapatkan Hasanah Card yg bisa berfungsi sbagai Kartu Diskon utk keberangkatan berikutnya sekaligus sbgai Kartu Alumni dan Member Hasanah seumur Hidup. #melayanisepenuhhati #hasanahtour #ukhuwahgroup",BoyHadiKurnia
1040,H : Teh aku pengen nike hijab T : Tapi yang itu ga dapet diskon deek   Ooobaiklah #Gagalgaul #CrazyPoorAsians,hennyokta
1041,Yuk di pesan sebelum harga naik.. Promo tahun baru sudah ready..  ** BIG DISKON SPECIAL PRICE **  Info. Fajar Daihatsu 0812 9334 2450 (Tlp / WA),fajardaihatsu
1042,@leejjenno @lonjuinh Anak dajal  Mau yang jenis gimana nih pawang nya bisa request lagi diskon nih ayo terbatas lho waktu diskonnya,najaemifn
1043,Transaksi di Trans F&amp;B gunakan voucher diskon aja! Diskon mulai dari 20-25% dgn mengirimkan SMS ke nomor 08 111 89 5757 &amp; ikuti langkah selanjutnya. Selengkapnya klik disini https://t.co/zXrbRtjkHJ #VoucherDiskon #TransFnB #BenefitTransvision https://t.co/oA9HeVk736,TransvisionID
1044,"Ehh kapan lagi min, itu banyak stand nya lagi keliling nyari diskon wkwk https://t.co/LI86GDI2C5",cikopiii
1045,diskon kalo belinya banyak sama aja ya sama sama bangkrut :)),alvinrdna_
1046,"Tunik Shireen Ukuran: M-XL tercantum di gambar, no accessories Bahan: tercantum di gambarnya Harga ecer: 135rb/pcs  Beli banyak dapat diskon Reseller/Dropship welcome  Contact &amp; Order: https://t.co/YPDLjywkkr",ria_indra
1047,"Dan promo satu lagi, bagi yg berulang tahun di bulan november, diskon 20% deh, cuco kan? Syaratnya tunjukkan ID kalian supaya tidak ada dusta diantara kita... Yuk yg di area jogja dan lagi butuh pijat  #pijatjogja #pijatpria #pijatpriajogja #gayjogja #massagejogja",69_anasadam
1048,@arinschu untuk arin saya kasih diskon 1%,ptgmaknae
1049,"Setiap Event, Hari Besar dan Peringatan kami memberikan Promo, Diskon dan Sureprise lain",HamaruHandcraft
1050,@askmenfess Hmmm~~~ diskon 40% lhoo~~  Cuma 185.000  Yakin gamau kasih pacar umur 22tahun mu jam tangan inii? Hmmm~~ https://t.co/2pkWw3mDuP,holyeves
1051,@askmenfess 100rb pacaran di semarang mah dah lebih dari sekedar hedon nder. nih fyi bisa keliling kota pake trans semarang lagi promo pake gopay diskon 50% belum lagi makannya hedeh 100rb kenyang pol seharian,Annichut
1052,@rapxmonx Buset murah dong kalo kurang diskon :(,KSejeon9
1053,@KSejeon9 kurang diskon kayaknya .g,rapxmonx
1054,Mau berpergian tapi belum dapat tiket yang pas? Akhir pekan ini kunjungi KAI Expo di ICE BSD yuk! Banyak diskon hingga Grand Prize Daihatsu Ayla loh. Buruan #BlibliSekarang tiketnya di https://t.co/69vHdY5m72 agar kamu bebas dari antrian ;),bliblidotcom
1055,"Aku ke matahari donk, itu pun yg diskon 75% https://t.co/t7qODtdbEo",dherama
1056,============== KAOS FILA  ============= PRICE : HARGA DISKON Rp.70k/pcs  Spesifikasi Kaos : - Cotton Combed 30s Original 100% (High Quality) - Ringan &amp; Lembut. - Tidak Kaku &amp; Tidak https://t.co/tQbdP0twN2,ceksbeibeceks
1057,============== KAOS FILA  ============= PRICE : HARGA DISKON Rp.70k/pcs  Spesifikasi Kaos : - Cotton Combed 30s Original 100% (High Quality) - Ringan &amp; Lembut. - Tidak Kaku &amp; Tidak https://t.co/lL9K38HQ5y,ceksbeibeceks
1058,Tips  Menang Diskon Harbolnas Dngn Cara ini https://t.co/2P8b8TlB55,dedisuparman87
1059,============== KAOS FILA  ============= PRICE : HARGA DISKON Rp.70k/pcs  Spesifikasi Kaos : - Cotton Combed 30s Original 100% (High Quality) - Ringan &amp; Lembut. - Tidak Kaku &amp; Tidak https://t.co/QxlYfBI84s,ceksbeibeceks
1060,AMAZONE Promo Diskon Up to 30%* dengan Kartu Kredit/Debit Mandiri | sd. 31 Desember 2018 https://t.co/HOtVhqODye,katalogpromosi
1061,"@educationfess aku di optik nder, 700k sama lensa itu di diskon soalnya aku langganan beli disitu hhh. frame nya yang mahal :( jadi cari frame yang murah aja kalo kamu bosenan orangnya",aleeschang
1062,"@BNI Cashback atau diskon, Min?",JoyonegoroAmri
1063,"@womanfeeds Di semua watson kayaknya ya ini, liat juga di watson pacific place diskon",dixaxterology
1064,"PROMO 30 oktober - 5 November 2018!  Korean Skincares!  Check it out, harga tertera sudah diskon. Belum dengan ongkir yaaa https://t.co/uvOE0xywjh",belvelvet
1065,"@aerocutipie Wkwkwk  Ada diskon soalnya susah nin, hehe",novayanty09
1066,@Regran_ed from @hosofshopaholic  -  BOOM SALE !! Wait is Over!! Dari hari ini sampai dari tanggal 1- 5 November Diskon All Items 30-40%!! Tempatnya di Parkiran House Of Shopaholic https://t.co/8em4UkHvtz,sale_yk
1067,"Lagi diskon pas gada duit kan nangis :"" https://t.co/RMQrw1L4mv",pinkeujeje
1068,@New_preloved Jual produk2 jims honey dan makeup original Ada shopee Banyak diskon :),DevyKurniaw
1069,"Astaga terniat dipengujung taun wkwk. Kalo lu bisa nonton tanpa senyum, gue kasih miper gratis gapake diskon wkwkk https://t.co/OAk1lCNHxb",XBTSZ
1070,@oktaecchi_ iya diskon 100k HUHU GODAAN,syahlaptr
1071,The Duck King AEON MALL Jakarta Garden City Soft Opening Promo - Harga Spesial Dimsum Rp. 21.800++ atau Diskon 20%* | Lihat informasi dan ketentuan promosi selengkapnya hanya di https://t.co/ZDrKMwWn9n,katalogpromosi
1072,Cung... Siapa yang punya akun BliBli...   Lagi ada promo ketce buat besok...   Diskon sampai 250rebuu loh..,dewy_chalim
1073,@pieceeees @womanfeeds Aku bru aja beli itu krna tergiur diskon  pas liat rep2an pda blg bgus krna nahan minyak d wjh ,mychickent
1074,@ijasikka Shit i just remembered abt my shirt too...... like itu aku bisa beli anytime sih tapi.... ngejar diskon..... holiday sale.... im not even sure now I wanna buy don though fr  Oh bener juga ya! Temenmu rencana mau beli juga kah?,imgnrsprt
1075,@ArdiansyahIbra1 Yang diskon,radityamfadil
1076,"YA ALLAH YA RABBI, ADA SEPATU LUCU BANGET TERUS LAGI DISKON MO NANGIS ",Iimsadiyah_
1077,@askmenfess Anw lagi ada diskon di Zara PIM guys check it out!!,nanayourbae
1078,"info layanan.  kulit lagi kering-keringnya, terus tadi ke pamela cari henbodi nemu ini, lumayan gede cuma 13rb, diskon dari 20rb. baunya ada 3/4 macem, paling masuk di aku yg vanilla ini.  yaa lumayan buat lembabin ati. kulit. dan dompet.  https://t.co/41NMxFDMVD",mshtaa_
1079,"@ectuals /; Wah tentu saja, kalau lagi senggang pasti saya kesana. tolong siapkan diskon ya? hahaha",schnyoon
1080,"@Secretlyfan_ wkwkwk godaan diskon mbak, banyak mau dibeli tapi ga important amat tapi hasrat ini ",flashesism
1081,"Join bisnis aku yokk Investasinya hanya Rp.9.900,- Kamu uda dapatin :  - Katalog - Diskon 23% semua produk - bimbingan untuk pebisnis yg mau dapatin penghasilan bulanan dan liburan - khusus bulan ini bisa dapatin hadiah2 ini  Dimana lagi coba investasi semudah ini",Mega_adelia16
1082,"Ada Diskon 40% untuk Menu Grill &amp; Bar Night Grand Aston Cityhall Hotel and Serviced Residences  Oya, ada promo Grill &amp; Bar Night, yaitu diskon 40 % untuk semua jenis menu! Dapatkan juga diskon hingga 50% untuk... https://t.co/2cK4MO7wBS",medanreview_
1083,"Ada Diskon 40% untuk Menu Grill &amp; Bar Night Grand Aston Cityhall Hotel and Serviced Residences  Oya, ada promo Grill &amp; Bar Night, yaitu diskon 40 % untuk semua jenis menu! Dapatkan juga https://t.co/1qZ7JPcLL0",medanreview_
1084,@couvklat Blm diskon,ohseufhn
1085,"@Regran_ed from @KusumaEdupark  -  Yang udah pada mantengin, nungguin diskon Bulan November Mimin kasih tahuuuu nih gaessss !! . Banjir Diskon 30% &amp; 50%  Di jam-jam yang sudah tertera yaa https://t.co/nVtEBhtCJ3",sale_yk
1086,"Udah malem gini mau ngegrab pake diskon rentan di cancel. Kebanyakan udah pada gak ngejar setoran jadi males kalo ambil yang pake promo, mau gamau ludes dah saldo gw hahaha. Padahal kalo dipake siang bisa buat seminggu kalo di promoin wkwkwk.",djellyboy
1087,Diskon! Di mal ga dapet jeans keren harga 100rb! Cepet order di WA 081293994981 https://t.co/IYhdLWLRCP,BillionStore
1088,@id_fm miinn fm 19 diskon nya pas winter sale aja apa gimana ? hehe,JodiAldrian
1089,@mutheaah @rlthingy Guardian ato watsons ada kok. Tapi guardian lg diskon masker ini,pufutrifii
1090,ALFAMIDI Promo DISKON hingga 3% untuk pembelian SGM Eksplor 1+ atau 3+ dan 5+ dengan Kartu Mandiri | Informasi selengkapnya di https://t.co/ledYXQPSz7,katalogpromosi
1091,@vinaerose Sri rejeki dkt rumah rivan diskon terus vin,Billy_Sagesta
1092,@dahyuntsi @Seungriceyo @FreeyeayEnt MAKAN AJA DI AORIRAMEN SIAPA TAU DI KASIH DISKON APA GRATIS SAMA OPPA RIRI HYUN,metaeyeonkim
1093,"@couchiepotato Mana lagi banyak diskon yakan :""( kzl kenapa sih diskon nya pas aku lg cekak huhu. Thank youu bubbbz ",bacyooot
1094,"@SWENDY7s gak ada diskon buat Dita, tq.",wildthenfree
1095,"Jangankan toko mahal. Gua masuk matahari aja ngitung diskon, udah murah tetep gak kebeli :( https://t.co/YozgzskFC6",demitrityass
