,0,1
0,Ya anjir cpt bgt ya abis barang manusia diskon:(,SOHEEDCH
1,Lazada 11.11.2019 diskon terbesar 24 jam https://t.co/8QjlwZWEz8,Vallno_07
2,"selama kalo liat promo diskon 70% + 30% dalem hati langsung bilang ""ini jadi gratis dong?""  ITU TANDANYA ANDA MASIH MISKIN",bayu_joo
3,"Apa bedanya matahari sama bulan?  Matahari ada diskon, bulan gak ada  Yhaaa *krikkrik*",Hanifati_f
4,@GarudaCares bagaimana cara tukar mileage diskon 70% (garudamiles year_end festival)?,Nug_QA
5,@Gencamon Nahiya benerrr hahahaha kalo makan cantik kena diskon gapapa deh rela makan makin lama yang pentinf diskon ,primetam
6,FAK GMARKET KENAPA DISKON NYA SEKARANG SIH,singularyv
7,"Sejarah Asia Tenggara Karya M.C. Ricklefs Rp 350.000 diskon Rp 210.000  Order: https://t.co/VIEtImeMoM  atau   WA 0813-8543-0505 Komunitas Bambu Jl. Taufiqurrahman No.3 Beji Timur, Depok  Buka Senin-Jumat pukul 08.00-17.00 WIB  #komunitasbambu #sejarahasiatenggara https://t.co/xXDT22UODI",KomunitasBambu
8,"@amingcoffee transmart kuburaya diskon, kapan lagi Rp.5.000 ngopi di mall . #kalbarinfo #kalbar #pontianak @ Transmart Carrefour Kubu Raya https://t.co/b8z6ySRnUn",kalbarinfo_
9,Tah diskon 50% cenah..  Yuk diserbu..   https://t.co/4vsqPgAn7H,AmaAbiyyunShoh
10,@wongAlas901 @prabowo @aniesbaswedan rika wis inden mobil esemka nek arp tuku gagian mumpung diskon....,Dianhandoko6
11,"Sebenarnya bahagia itu sederhana... - beli ini kebeli - beli itu kebeli - liat onlen shop diskon flashsale langsung beli - kalo ada abang-abang telor gulung minimal beli 25rebu. - buka instagram, liat mukbeng, pesen gofood, beli. - ga miskin.  hidup sesederhana itu ya gengz.",anggieppu
12,Yuhuu..  Siapa lagi yang mau order deodorantnya...   Deodorannya murah tapi ga murahan loh..  Favorit keluarga aku nihh deodorantnya Lagi diskon ,indri_indriyuni
13,@febjae Iya teh ambil aja yang kuning mah. Diskon 50%,favechan
14,Pesta Harga Akhir Tahun di GIIAS Medan Auto Show 2018! Banyak promo dan diskon khusus yang hanya berlaku selama pameran GIIAS Medan berlangsung. Slide langsung yuk https://t.co/zgxDeOwRsu,IcanIndopro
15,Yaampun kak aulll. Eh tapi itu make over lagi diskon kak? https://t.co/o8KgL937hF,tyoungjaems
16,@rahagyu29 @bayu_joo Jadi misal harganya 100rb diskon 70% + 30% Cara penghitungannya 100rb - 70% = 30rb Lalu 30rb - 30% = 21rb. Jadi masi ada yg harus dibayar ga gratis juga ,gardagagar
17,Pesta Harga Akhir Tahun di GIIAS Medan Auto Show 2018! Banyak promo dan diskon khusus yang hanya berlaku selama pameran GIIAS Medan berlangsung. Slide langsung yuk https://t.co/pKiVNIwwcF,IcanIndopro
18,"Rizka tunggu d htel y say, opn include PROMO ptongn diskon 150k &amp; 300k hnya berlaku rabu-jumt. #wisatalendirjogja #AvailJogja #AngelJogja #bisyarjogja #JogjaBO #jogjanakal #jogjalendir #jogjabispak #jogjacrot #bojogja #WPjogja #readyjogja #jogjaincluderoom #wisatalendirjogja https://t.co/Cigbjux9bU",Rizkaulia3
19,"@tys1004 mau beli season greetings tia, per hari ini ada diskon gede. lumayanlah, kutergiurrrr",ChocoBee_
20,"CGV Cinemas kini hadir di Icon Mall #Gresik . Dapatkan diskon 20% untuk pembelian min. 2 tiket nonton melalui aplikasi/web GOERS, dengan menggunakan kode voucher https://t.co/yjjLIb7XoV",GoersApp
21,@princekuanIin fansite kyknya soalnya itu pun po di diskon:( kalo ntar pas ready harganya 265k belom ems dan tax anjer,aracelli_0129
22,"Beli tiket kereta api di @tokopedia diskon 20% pakai ePay BRI, min. trx. Rp100rb. Info lengkap https://t.co/1CvgQEWBkC https://t.co/hO4Z2UB2Uk",promo_BRI
23,Buat kalian yang bisa jajan di ALFAMART - Yuk di cek dulu Katalog Belanja ALFAMART Periode 01-15 November 2018 | Mana tau ada diskon buat produk yang lagi kalian pengen beli | Lihat yuk selengkapnya disini https://t.co/tqA8sL8MQk https://t.co/oP5S58D4pu,katalogpromosi
24,"STARBUCKS Promo Diskon 50% untuk pembelian minuman Holiday Special*, menggunakan Starbucks Tumbler / Mug dan Kartu Kredit BCA | Lihat dulu yuk syarat dan ketentuan lengkapnya disini https://t.co/P3daX4wl1C",katalogpromosi
25,Sempurnakan alat dapurmu yuk! Peralatan dapur yang Kamu butuhkan diskon hingga 84%!!  Belanja sekarang yuk &gt;&gt; https://t.co/YND6YiFLZY https://t.co/oPb1ozHGr4,alfacartID
26,@gramedia handmaid's tale belum ketemu miinn dan diskon buku juga paling dicari sih :'),Ljwoori
27,@YRachmania Temen gue nitip temennya pas di hongkong lagi diskon 30rebu doang tjoy ,urpoisonivy
28,{Np} 6 tiket diskon 50% masuk gelanggang samudra 30k aja berlaku sampe 15 nov 2018 https://t.co/9Ow2Utd9yw,New_preloved
29,"Kalok minta diskon, telponnyaaaa berkali kaliii...  Giliran diminta pelunasan, slow respond, not feeling well!!  YHAAA BHAIQUEEE!!   *saya jugak kalok ngeluarin duit jugakkk not feeling well Paaakk!!*",Kmunadiayuna
30,"Prime Gears Beri Diskon Menarik Helm Arai, Taichi dan Komine di IMOS 2018 - https://t.co/UvTWkFlGNB https://t.co/N6EVOIZN6W",motovaganza
31,Kunjungi Showroom kami dan bergabunglah menjadi member untuk mendapatkan banyak manfaat dan diskon seumur hidup,iwakkoi_center
32,yaallah aku sudah teracuni diskon shopee lagi,gramedira
33,"@Fiiildzah @gojekindonesia nggak tau nih kak, tiba2 dapat 10 voucher diskon gocar",ademutiaraa
34,@gramedia komik harga diskon gila an plis..,RomeoInsulind
35,"Sesuai janji kami beberapa bulan lalu, kini program diskon BIG THANK YOU SALE 25% berlaku seluruh Indonesia di sepanjang bulan November ini! Spesial untuk buku sastra! #bukugpu  https://t.co/F9LNZlKYia",bukugpu
36,"Longdress Polos Renda Ukuran: tercantum di gambar, no accessories Bahan: tercantum di gambar   Harga ecer: 120rb/pcs  Beli banyak dapat diskon  Reseller welcome  Contact &amp; Order: check Bio https://t.co/rAE6XSAy2m",ria_indra
37,"Berbagai marchendise tipe-x ada di sini, #invit 7A2C0EE6, beli #murah #diskon",X_SKAsuka
38,"gmarket lagi ada diskon mega sale nih,  wanna one album set jadi 25.500 won (aslinya 34.000 won) trus yg kihno ver jadi 15.800 won (aslinya 20.000 won)   should i buy all of them? ",jinhwiyaa
39,@IndonesiaGaruda Sdh dcoba berulang2 malah pas bs pilih schedule poinnya gk diskon 70%...benar systemnya kah?,Nug_QA
40,"Cardholders, jangan lupa yah kalau mau beli tiket untuk traveling, ingat Qatar Airways karena dengan #mandiricard sedang ada diskon 10% loh. Yuk tunggu apalagi. https://t.co/mzV5FCcXNz #mandiripromo https://t.co/tTl4oUaO65",mandiricard
41,@kaesangp Minta rekumem mas.. Gmn bli spy dpet diskon..,untung_hr
42,"@benzbara_ @StorialCo Kalau nggak salah, buat baca Espresso, sy menghabiskan pulsa sekitar 50ribuan buat isi coin storial. Diskon coin  sampe 50%. Nggak terlalu berasa karena beli coinnya juga nyicil. Jadi kantong tak sobek kok ",iladelfa
43,Kamu bakalan dapat diskon 25% kalo beli tiket pake kartu BTN https://t.co/tgRFUhAOGR  #ecogreenpark,ecogreenpark
44,https://t.co/xVvp3iKDVy bekerja sama dengan Korea Tourism Organization (KTO) menggelar promosi diskon Rp 1.000.000. https://t.co/I0guSxn61l,KompasTravel
45,#Pragiwaksono Amsterdam teramat menyenangkan. Gue kembali dengan Batik dari @batikplatform . Jangan lupa belanja di website @batikplatform pake promo code PRAGIWAKSONO akan dapet diskon https://t.co/CMqyXULsdf,pandji
46,"Kalau membandingkan dengan Yaumul boleh, asal kamu salah mengenalku. Seumuran itu harga dirinya gede. Diskon anti katanya. Dunia seluruhnya milik bersama, katanya.",rizky_alfian463
47,"Hai Millenials Bogor, kami akan hadir di Botani Square mulai LUSA s/d 11 November 2018. Dapatkan HARGA TIKET DISKON SPESIAL untuk kunjunganmu di libur akhir tahun  https://t.co/RK8be96TRU #Jungleland #DuniaCeria #JunglelandTEDUH #2018GoesToJungleland https://t.co/87v91BTQ0S",JungleLand_Indo
48,Halo adakah yg buka go prive shirt yg lg diskon 30% ini?? Ongkirnya gila bgt w gk kuat kalo sendiri :(,sooisxing
49,"#SahabatKAI, mulai 25 Oktober 2018 pemesanan tiket via KAI Access, Contact Center 121 dan web https://t.co/sQEDaRO4Oj, tidak dikenakan biaya pemesanan tiket dan diskon channel #AyoNaikKereta https://t.co/odjTZ4k0xK",KAI121
50,orang2 liat barang diskon 50% langsung diborong  aku liat barang diskon 50% ngitung dulu harganya jadi berapa setelah dipotong diskon eh tetep ngga kebeli,bayu_joo
51,@sendernim Oh kirain lagi ada diskon,kkangdniel
52,diskon 30% lho... @ New Taipei City https://t.co/gDcGvg3FvF,PrimadonnaINA
53,"@bayu_joo kalo harga 120.000 didiskon spt diatas = dapet diskon 84.000 = 36.000 didiskon lagi 30% = dapet diskon 10.800, jadi bayar 25.200  gitu bukan kak? hweee",nosa_saraswati
54,Jual Buku Serba Diskon: SEJARAH ISLAM DI TANAH JAWA https://t.co/H8kdUiehQR,eswaachmad
55,Pen &amp; Paw menjual kaos-kaos branded dan murah2.. DISKON 10% untuk ALL ITEM!! buruan add 2256EA97 ##penandpaw,penandpaw
56,Indocomtech 2018: Cashback Hingga Diskon 90% https://t.co/9fnCBqT9az @inilahdotcom,wbtvportal
57,"Pukpuk ...beli di Mimin aja Kak, diskon khusnudzon https://t.co/iAlISduMog",divapress01
58,Indocomtech 2018: Cashback Hingga Diskon 90% https://t.co/PI7Hw6b6R2,ayobaca123
59,Jual Buku Serba Diskon: PETUAH-PETUAH LELUHUR JAWA https://t.co/DYAoBSvWbs,eswaachmad
60,Hi #kangseekmiquiz hadir kembali Yuk di jawab dan dapatkan voucher diskon yang bisa dipakai untuk CUCI AC dari https://t.co/8B3CJRuYtm. Yuk langsung jawab dengan format: Nama (spasi) Kota (spasi) Jawaban  #seekmi #seekmiaja #kangseekmiquiz #kangseekmi #jabodetabek https://t.co/OuMJGv9NPV,SeekmiApp
61,"Tunik Marbella Ukuran: tercantum di gambar, no accessories Bahan: tercantum di gambarnya Harga ecer: 110rb/pcs Beli banyak dapat diskon Reseller/Dropship welcome  Contact &amp; Order: check https://t.co/WKOuFtu9V7",ria_indra
62,Halo! Temanmu baru mengirimkan Rp7.500 di Lazada. https://t.co/MRQABJljvs diskon besar besaran https://t.co/gXULUrwzwd,Sanderia10
63,"Nginap di Hotel Ini, Peserta BPJS Cuma Bayar Setengah!  Banyak diskon lainnya juga ditawarkan Pesonna Hotel Semarang. https://t.co/LyB189WMB6 https://t.co/LyB189WMB6",sumberita_id
64,"@peyekkeyep @infomalang Belut Prima Cak Wanto juga sip, apalagi kalo belinya pake ojol yg suka ngasi diskon mabelasrebu itu. ",MLG_backpacker
65,Selamat Buat Mbk Ami Malinso  Bulan lalu banyak dapat hadiah  . . . Gratis Parfum The One dari Kak Agung Sagung Indah Absari Group  Lolos Jam Cantik Juga  Dan Dpt diskon 50% untuk 1 produk bulan ini yeyy  Go Higher mb,Sumar_diamond
66,"@bayu_joo Gue kalo liat diskon 50% atau 70% gak terlalu fokus, yang jadi fokus gue kalo liat diskon itu adalah harga awalnya berapa",Rp1899
67,"Black friday, app store nya apple biasanya ada diskon gitu nga sih? @makemac",rann_dy
68,"bingung bgt ini &gt;&lt; beli di gmarket apa po olshop biasa (eg:https://t.co/W8H8qZzvUQ) ? kalo beli di gmarket beli full apa album aja ya? gmarket (ada diskon) : album set + kihno + ems = 790k , album set + ems = 560k   bingung bgt &gt;&lt; siapapun tolong akuuu https://t.co/qxOkIElI6J",jinhwiyaa
69,Udah dibuka yaa order bulan November  Make up nya banyak yg diskon ,PujiiYanii
70,"@mffttaa Hi, terkait diskon merchant silahkan kamu konfirmasikan ke pihak merchant langsung ya, untuk informasi kode diskon Kredivo hanya dapat di lakukan pada transaksi pertama di Kredivo ya. Salam Hangat :)",kredivo
71,Juventus Upayakan Diskon Harga Juan Mata Dari Manchester United - https://t.co/4o1UWcTS8A https://t.co/EfzJRj0KLQ,gilabolacom
72,"OCTOSAVE dari @misteraladinID DIPERPANJANG lho! Kamu bisa nikmatin diskon s.d 15% (maks. Rp1,2 JUTA) untuk semua hotel di Mister Aladin sampai dengan 04 November lho. Tunggu apalagi? Ayo, pesan SEKARANG juga! CEK: https://t.co/NVanG96wZt https://t.co/Nta3QzMkEP",MNCPlayID
73,"OCTOSAVE dari @misteraladinID DIPERPANJANG lho! Kamu bisa nikmatin diskon s.d 15% (maks. Rp1,2 JUTA) untuk semua hotel di Mister Aladin sampai dengan 04 November lho. Tunggu apalagi? Ayo, pesan SEKARANG juga! CEK: https://t.co/TAVtnjWMdS https://t.co/czctLXURJu",MNCupdate
74,Beberapa toko di shopee bener sih dia diskon up to 90%. Tapiiiii........harga aslinya ditinggin beberapa kali lipat. Kan sama aja jadinya gak diskon hmm,rezkyintanr
75,lusa nonton gintama... btw wingstop belom keluarin diskon ultah yak,Yuki_0911
76,nawar harga barang jangan sadis sadis amat laaaaaaah~ #Terbaru #Esai https://t.co/U7cA80yLIF,mojokdotco
77,"Hi Friends, kami hadir kembali tahun ini di Indocomtech. Langsung mampir ke booth https://t.co/69vHdY5m72 buat kamu yg lg cari gadget terkini dgn diskon yg luar biasa. Yuk ke Hall A JCC Senayan! #BliblionIndocomtech https://t.co/t3ONiujGt7",bliblidotcom
78,"Brands favorit sekelas Fossil dan FujiFilm siap bikin kamu menjerit! Gimana enggak, semuanya bakal kebagian cashback 100% dan diskon sampai 70%. Buruan #BlibliSekarang,  hanya di #HisteriaJeratJerit, kalau kamu gak mau kehabisan.",bliblidotcom
79,Happy Halloween! Saatnya menikmati treats of the week dari handphone &amp; all tablet hanya di https://t.co/69vHdYmXvC! Penawaran dan diskon spesialnya dijamin buat kamu merinding!,bliblidotcom
80,"Tampil cantik juga butuh peralatan lengkapnya dong. Di sini kamu bisa dapatkan banyak pilihan untuk semua peralatan yang kamu butuhkan, dengan diskon spesial tentunya. Cek dan #BlibliSekarang yuk ;)",bliblidotcom
81,"Hi Girls! Office look kece #RabuCantik dari brand ternama seperti Fossil, Melissa, dan lain - lain siap bikin penampilanmu makin oke. Diskon spesialnya sampai  75% dan masih ada diskon tambahan lainnya loh. Cek dan #BlibliSekarang yuk ;)",bliblidotcom
82,Juventus Upayakan Diskon Harga Juan Mata Dari Manchester United https://t.co/ZV3P4apUk1 https://t.co/LOK1FPw1Rl,pocongfootball
83,"Hey bro, VGA card Nvidia dapat ekstra diskon hinga Rp150.000 loh! Sebelum kehabisan buruan cek dan #BlibliSekarang yuk ",bliblidotcom
84,"@nayasaa Iya, pas discount period due to their openingnya. (so jaksel tapi males translate)  Kemaren uniqlo sency diskon semingguan.",pisangmadu
85,"Diskon Toyota Bogor, hub: 085701512000 #ToyotaBogor",BogorSHOPPING
86,@kaesangp Lg ada promo ga ? Misalkan diskon 100% gitu mas .,iman_rosyadi23
87,Dapatkan banyak diskon dan harga spesial di Ace Hardware BIG Mall Samarinda. Jangan sampai kehabisan yaa BIGers~ https://t.co/uitwgvcZoS,bigmall_smd
88,@persebayastore cara gunakan PS card untuk dapat diskon belanja online bagaiamanakh?,AzzamAyahe
89,BREADLIFE Promo Pay 2 For 3 / Pay 6 For 12 / Diskon hingga 30% dengan Kartu Debit BCA  Kartu Kredit BCA  Flazz dan Sakuku | Lihat informasi dan ketentuan promosi selengkapnya disini : https://t.co/oobJQmm7aG,katalogpromosi
90,"Cardholders, sudah pada gajian belum nih? Setelah gajian boleh banget loh makan siang bareng sahabat di Tom Tom. Jangan lupa gunakan #mandiricard dan nikmati diskon 20% #mandiripromo https://t.co/LH9p7xwY24 https://t.co/CygvK9ncbc",mandiricard
91,mirota tuh emang ya. udah paling murah masih juga masih diskon. :))),heroxiine
92,@askmenfess Harusnya bahas diskon gini nih yg banyak! Beli dimana buru jawab!!!,sugarosey
93,@askmenfess iya di mirota juga diskon kmrn,heroxiine
94,"Halo! jadi Big Bad Wolf (BBW) lagi ada di Medan nih. aku mau buka jastip, siapa tau ada yg mau beli buku dr BBW, lumayan loh buku impornya diskon dr 60-80% anw, jastipnya 20rb aja per transaksi. nanti kalian blg mau buku apa terus aku cariin getoh",bymaxx23
95,Siapa lagi yang mau join reseller Nibras kak... Berikut ketentuannya: Pembelian mulai 1 pcs diskon 10% Mulai 3 pcs diskon 15% Mulai 6 pcs diskon 20% yang malu2 chat Mimin 082324126647,niessa_Zoeharto
96,Yang Perlu Anda Ketahui Sebelum Festival Belanja 11/11 dan 12/12 https://t.co/vHnEM8dG6x  Akhir tahun merupakan pesta bagi pelaku e-commerce di Indonesia dan Asia Tenggara. Hal ini disebabkan banyak promo diskon seperti 11/11 dan 12/12 yang jatuh di pengujung tahun. Data Criteo,SayaSukaGudeg
97,Spesial 59rb saja sis! Yes! Tas cakep eba1602 ini tersedia 2 warna! Cakep siss. Mauu?? Harga di website https://t.co/tw33RvJQCX BELUM diskon! Bisa diskon 60rb setelah member! Member itu GRATIS sis! https://t.co/pt35Ma5QwX,peduligaya
98,@FiersaBesari Beli nya besok aja bang klo udah ada diskon 50% + buy 1 get 1 :((,irvan_ariffin
99,Diskon Tas ,imala_lala
100,https://t.co/ZI6M0uu8cFAmbil voucher &amp; dapatkan diskonMARVEL Avengers Infinity War T-Shirt Style #13 - Navy [S] Harga awal: Rp 89.000 Harga https://t.co/ZI6M0uu8cF: Rp 71.200 Link: https://t.co/CqIA5qkEYB,eka_octo
101,"@bIuebcrry [ LINE ]   Diskon?  Nggak. HEHE  Selama gue belum sepenuhnya bahagia, diskon is a no no  :)",yongbokcells
102,@rlthingy gw cmn dapet big mac tp itu aja ga diskon ,annisaanne_
103,@Dumai_Nakama Sekarang lagi ada diskon kok Grameds. Diskon 15% buku terbitan Gramedi dan produk special Gramedia untuk pengguna kartu kredit BRI dan diskon 10% buku terbitan Gramedi dan produk special Gramedia untuk pengguna kartu debit dan brizzi BRI.,gramedia
104,Mari Rayakan Ulang Tahun dengan Pesta Belanja Lazada 11.11 https://t.co/RnullDTJ8p #Diskon #Belanja #Shopping,bairuindra
105,@noviaprims Diskon 15% buku terbitan Gramedi dan produk special Gramedia untuk pengguna kartu kredit BRI.,gramedia
106,@noviaprims Diskon 10% buku terbitan Gramedi dan produk special Gramedia untuk pengguna kartu debit dan brizzi BRI.,gramedia
107,"Hi, gunakan kode berikut ini joice97Q9ANM2XNT untuk mendapatkan diskon pembelian paket ruangbelajar di Aplikasi mobile @ruangguru",Joice06708598
108,"Dapatkan Diskon 50% All Item !  Syaratnya gampang banget, Kangmas dan Diajeng cukup datang memakai baju warna hitam ke Outlet GeprekBoss di Subha Foodfest Lt. 3 Galeria Mall . S&amp;K: hanya berlaku makan ditempat ya boss  hanya berlaku tanggal 31 oktober 2018 https://t.co/TOJ4IXDzn4",galeriamall
109,belanja dilazada diskon besar2an https://t.co/cLqln1Gbdb,Vallno_07
110,Heii otwlovers udah tau belum di @otwpku ada diskon 50% loh untuk semua martabak manis buruan ke @otwpku Sekarang cobain martabak nya dan masih banyak juga loh promo dan diskon lain nya #udahotw #otwfoodstreet #otwpku #minumanpku  #pekanbaruhits #pkuhits #kulinerpku ,OtWpku
111,"@kredivo min, mhn penjlsan kenapa diskon yg saya dapatkan sbsr 100rb, tau2 hilang, padahal pembelian pertama saya gak sampai 10rb dilazada.",NinaDinawati
112,"Gajian makin seru di https://t.co/r9MwgvqhaA dengan diskon produk WRP hingga 15%. Yuk, beli sekarang juga karena promo hanya hingga 5 November 2018! https://t.co/zjMi0Z8GVZ",NutriMartID
113,@afadhima @Rabbiyaya @lynmtea @suryaramadann @lmilatiana @gardagagar @devidaputriay @rahagyu29 @bayu_joo Aku selaku penjualnya biasanya aku naikin 10% dari harga normal baru aku diskon  haha,adjianto_fendi
114,"ILUNI MM-UI dan Selasar, present CEO Talks: Seminar Management Insight-Leading Millenials.   Pesan tiket, dan dapatkan diskon 20% dengan sebut kode promo: kumparan, dan tunjukan bahwa kamu sudah punya aplikasi kumparan saat datang di acara! Register now: +62816939424 (WA Only) https://t.co/kZkYWXUHo0",kumparan
115,Astaghfirullah ini GrabFood diskon terus gue kapan nabungnya.  ),YONGJIM2F
116,SPECIAL PROMO BUAT ANDA PECINTA DESAIN !!!  *JASA DESAIN LOGO (DISKON 5%) *JASA DESAIN BROSUR (DISKON 5%) *JASA DESAIN KALENDER (DISKON 5%) *JASA IKLAN DI SSE (DISKON 15%)  DAN BERBAGAI PELAYANAN TERBAIK UNTUK DESAIN !!!  AYO  HUBUNGI SEKARANG WA : ASSEGAF (0817-7997-5106) https://t.co/V0ArEQF9xm,SatuViral
117,"Saya beli kedua kalinya, tapi tetep aja tidak dapet garpu kecilnya. Gimana ini @kaesangp ? Harusnya dapet diskon 1000, karna garpunya tidak diikutsertakan. https://t.co/kTAnau1TIK",Haerlin___
118,Ayo dibeli dibeli mumpung diskon akhir tahun.  https://t.co/H2t99jib8q,giewahyudi
119,@dsuperboy 10 ribu bang +esteh+krupuk.. kadang dapet diskon gorengan 1. Hhh,zaa_azhar
120,Diskon Nutella Picu Kekacauan di Seluruh Prancis - https://t.co/TXsSsOLfdY https://t.co/9oELuEXe68,citizendailynet
121, WOODSKIN YELLOW SQ   Bahan : Woodskin  Size : 115 x 115 cm  Harga : Rp. 48.000  Beli 3pcs  @ 46.000  . Diskon 2 ribu/pcs untuk setiap pembelian 3 pcs yaa ukhty..  (Boleh https://t.co/eYwUcQHV9P,ArsitaWPram
122, WOODSKIN ORANGE SQ   Bahan : Woodskin  Size : 115 x 115 cm  Harga : Rp. 48.000  Beli 3pcs  @ 46.000  . Diskon 2 ribu/pcs untuk setiap pembelian 3 pcs yaa ukhty..  (Boleh https://t.co/FMwmmGQtnZ,ArsitaWPram
123,"Ingin traktir lunch teman sekantor tapi bingung pilih restorannya? Kenapa ngga ke Pizza Hut aja dan tukarkan #fiestapoin Sahabat, ada diskon hingga 30% loh. https://t.co/yeMn4qWS0g https://t.co/yqFFg1ni1R",bankmandiri
124, WOODSKIN BATA SQ   Bahan : Woodskin  Size : 115 x 115 cm  Harga : Rp. 48.000  Beli 3pcs  @ 46.000  . Diskon 2 ribu/pcs untuk setiap pembelian 3 pcs yaa ukhty..  (Boleh mix https://t.co/p1YAASXon5,ArsitaWPram
125,@beauthingy Banyak yang diskon tapi duit ga banyak ,euphoari
126, WOODSKIN BROWN SQ   Bahan : Woodskin  Size : 115 x 115 cm  Harga : Rp. 48.000  Beli 3pcs  @ 46.000  . Diskon 2 ribu/pcs untuk setiap pembelian 3 pcs yaa ukhty..  (Boleh https://t.co/FLZfhvJJpz,ArsitaWPram
127,"@Afinszabramatyo Diam-diam kok, ga buka shopee gatau kalo ada diskon",asrinura
128, WOODSKIN MOCCA SQ   Bahan : Woodskin  Size : 115 x 115 cm  Harga : Rp. 48.000  Beli 3pcs  @ 46.000  . Diskon 2 ribu/pcs untuk setiap pembelian 3 pcs yaa ukhty..  (Boleh mix https://t.co/5TXQwrfkfX,ArsitaWPram
129,"yang mau liburan ke #TransStudioBandung weekend ini, yuk cus di manfaatkan Friends promonya! Love &amp; RT tweet ini dan tunjukkan di loket kita untuk mendapatkan diskon 25% HTM Trans Studio Bandung! 1 RT untuk 1 tiket ya, friends!   Periode promo : 1 - 30 November 2018 https://t.co/hz8VM7mUHB",TransStudioBdng
130,@bayu_joo Bang diskon itu apa sih gue biasa belanja dipasar gak pernh ada diskon cuy,Harychaniago
131,"Jangan lupa juga mampir ke boothnya BNI karena ada banyak promo menarik disini! Ada diskon hingga 1,3 juta, cashback hingga 1 juta dan juga cicilan sampai 6 bulan. Yakin gak pengen liburan pake promo ini???  #BNI46 #TTLF2018 #StartsFromTheCard https://t.co/C4hMZFlCv6",BNI
132,@gramedia kq kemarin ga dpt diskon pas belanja di gramed? ,Dumai_Nakama
133,"diskon Tiket(dot)com ini menarik sekali. sayangnya kalau pesan via app harus masukin nomor passpor. which is literally ya, passpor bangbew expired :"")  jadi yaudah pakai harga normal didiskon dikit via travel agen biasa. #udahgituaja",annisantyas
134,LAZADA Promo Elektronik Shopping Days! Diskon Hingga 50% + Voucher 10%! https://t.co/Lwaojrk9SN,katalogpromosi
135,"@integrawl @womanfeeds Maksudnya dia, include ongkir dan diskon semuanya jadi 60k mba",expelliarmoux
136,@MYGUCCI_BOI Semalem maybelline diskon beli pore eraser sm mascara cuma 100k :)) ga tahan aq tuch. Ntar 11.11 beli lagi(?),elysianim
137,@arh82 @sastragpu Tidak ada. Beli satu buku jg sudah diskon  #bukugpu,bukugpu
138,@laskar_minang masih mau minta diskon ?? https://t.co/ps6vgFAG1u,EDitektif
139,"@NinaDinawati Hi, Kami informasikan untuk kupon diskon Kredivo hanya bisa digunakan pada transaksi pertama menggunakan Kredivo atau user baru Kredivo yang belum pernah melakukan transaksi di merchant manapun. Salam Hangat :)",kredivo
140,@laskar_minang aduhhhhhh malah minta diskon lagi  https://t.co/1Pvgqegupl,EDitektif
141,"#2 RSB juga telah bekerjasama dgn ratusan pihak ketiga utk mendapatkan harga diskon &amp; diberi kemudahan dalan bertransaksi. Jd kamu ga perlu khawatir. Kalau mau tahu lebih jauh, segera gabung dengan Rezeki Sejuta Bintang. #RSB #RSBforSulsel #RezekiSejutaBintang #KartuSejutaBintang",komunitasRSB
142,@laskar_minang gak da diskon ya ,EDitektif
143,"Barang baruuu. Masih anget nihh, tengok yuuuu Kode :akasia wedges Harga :69000 Size : 36-40 Yuk diborong guysss! Beli banyak dapat diskon :3 https://t.co/NuIi5kxuxU  jual_beli kicaupromo",SepatuDocmartku
144,Flash sale sana sini ga ada yang jual watercolor paper diskon 70% gitu,AF_Hida
145,"Diskon Toyota Bogor, hub: 085701512000 https://t.co/UPX6O9lxEl #ToyotaBogor",Auto2000Bogor
146,"FLASH SALE TELAH DIMULAI! 100 orang pertama yang menggunakan kode promo RED4PM di jam 4 sore akan mendapatkan DISKON 25%. Hanya di RedDoorz App dan https://t.co/CQVxCqc3fU ya, #redtraveler! - Syarat &amp; Ketentuan: https://t.co/3krzBkjoN5 https://t.co/KGjr6U2e0Z",RedDoorzID
147,@ChocoBee_ engggaaa sepatu itu ga bakal diskon soalnya limited    Tau album jepang emang medit pol,tys1004
148,"Bagi anda yg menyukai penghematan dan Promo2 diskon , Mari Follow diskonevoucher krn banyak info diskon berguna bagi anda .. .",PontasYabesS
149,terapkan konsumsi syariah. biarkan diskon 11.11 dimana mana. biarkan.,likayuliana21
150,"@rvsoojoyie Aku tungguin deh yang penting diskon, setia kan aku? &gt;____&lt;",lovarruka
151,Hai Seafood Lovers. Diskon 50% Setiap Hari untuk menu yang berbeda masih ada loh.  Jangan lupa datang dan nikmati setiap menu dari @dcost_seafood  D'Cost Seafood Lt.Basement 1 TM Mangga 2 Square https://t.co/Ubg1VS5LXB,TM_M2S_APG
152,"Untuk mengawali bulan November ini, cobain paket bakso tulang iga dari @basomoomoo, yuk! Bayar pakai YUKK Cash dan nikmati diskon di Baso Moo Moo sebesar 10% + reward 15% yang bisa kamu pakai di pembelian selanjutnya. #YUKKpakeYUKK #DoubleSerunya https://t.co/PTrXbwS6Dc",yukk_id
153,Harga diskon sangat jarang di temukan #Robbyvers48,bagas_galeh
154,"Update apps https://t.co/69vHdYmXvC sekarang buat maen game #HisteriaJeratJerit! Dapatkan ekstra diskon hingga 500rb. Yuk kunjungi booth Dell, IT Galeri dan Canon buat scan QR Code-nya. #BliblionIndocomtech https://t.co/mZiKp21O4F",bliblidotcom
155,"Hey, klik linknya dan download app RedDoorz skrg untuk mendapatkan diskon menginap berupa RedCash senilai 50.000 di semua hotel RedDoorz! https://t.co/AsP9iQLPjy",mridwantama
156,Periode Promo Klinik Kiara HealthCare 1 November - 31 Desember 2018 UNTUK MU GURU Bakti Kami Untuk Kasihmu Diskon 35% untuk pemeriksaan medis dan laboratorium khusus untuk Guru di seluruh Indonesia. https://t.co/QE3lJjyZsj,KiaraHealthCare
157,"Headphone JVC paling mini, paling ringan, dan paling ringkas. Tipe apa ya ini  #JVCSound #PROMO #Murah #Diskon #headphone #earphone #audio #audiophile #audiopro #HiRes #musik #proaudio #indonesia #Headset #Headsets #Tokopedia #OfficialStore #Resmi #musikindonesia #musikhits https://t.co/rAyKEYiETT",JVCSound
