,tweet,user
0,ERAFONE EXHIBITION di Pondok Indah Mall 1  Duta Mal Banjarmasin dan Plaza Ambarrakumo Yogyakarta - DISKON hingga Rp1 5 Juta  tambahan diskon hingga Rp1 Juta menggunakan Kartu Kredit BRI &amp; Mandiri tanggal 29 Oktober - 04 November 2018 | Info lengkap di https://t.co/ZgZVu210H0,katalogpromosi
1,postingiklan Promo Peninggi Badan Diskon 50rb Paket 30hari/40 hari sampai tgl 26-08 083878097619 https://t.co/5PJuf2zmRG,rajapeninggibdn
2,COD pembelian voucher game online dengan murah + diskon! Kapan lagi? khusus untuk daerah jabodetabek yaaa!,mooienterprise
3,"NYX soft matte lipcream Harga counter 125.000 Disini diskon cuma 95.000 aja Produk original ya, no tipu-tipu  Boleh tanya dulu di kolom comment Langsung order, whatsapp 081394382728",kiranagita
4,Nikmati Promo of The Week booking hotel murah di Indonesia  diskon s.d 67% https://t.co/6pjtSxQcgS  #PromoHotel #HotelMurah #Liburan #Hotel,AyuTasia_
5,Masa depan tergantung pada impian kamu. Maka pergilah tidur saja sekarang diskon murah hanya di https://t.co/tUxk2Mul0P ##diskon #ollshop #shoping,efviel
6,"gak usa pusing, barang kita #murah ditambah selalu ada diskon #sale - cek aja ya sis/bro - https://t.co/idjcyqD6gi",olshopbali
7,"selama kalo liat promo diskon 70% + 30% dalem hati langsung bilang ""ini jadi gratis dong?""  ITU TANDANYA ANDA MASIH MISKIN",bayu_joo
